Rb;Istraživači;Predmet;NPP;Razred;Udžbenik;Lekcija;Negativni oblici ponašanja;Navedite šta;Univerzalne vrijednosti;Navedite šta;Partikularizacija;Sadržaji;Načini;Indikator 1;Aktivno učenje;Ne nudi se mogućnost diskusije;Indikator 2;Rješavanje problema;Puko pamćenje činjenica;Indikator 3;Mutiperspektivni pristup;Pristup jedne perspektive;Indikator 4 ;Diferencirani prikazi;Stereotipni prikazi
1;NH/FB;Geografija;B;6;GZ1;Uvod u geografiju;Ne;;Da;odgovornost, zaštitaživotnesredine NH-8-1.1;Ne;;;2;;;0;;;2;;;2;;
2;NH/FB;Geografija;B;6;GZ1;Kosmos i kosmička tijela;Ne;;Ne;;Ne;;;2;;;2;;;2;;NH-14-2.1, FB-10-2.1;0;;
3;NH/FB;Geografija;B;6;GZ1;Sunce i Sunčev sistem;Ne;;Ne;;Ne;;;0;;;2;;;0;;;0;;
4;NH/FB;Geografija;B;6;GZ1;Zemlja u Sunčevom sistemu;Ne;;Ne;;Ne;;;2;;;0;;;1;;FB-20, FB-21;0;;
5;NH/FB;Geografija;B;6;GZ1;Geografska orijentacija - horizont i orijentacija na horizontu;Ne;;Ne;;Ne;;;2;;;2;;;0;;;0;;
6;NH/FB;Geografija;B;6;GZ1;Orijentacija na površini zemlje;Ne;;Da;saradnja NH-28-6.1;Ne;;;1;FB-30-6.1;;1;FB-30-6.1;;0;;;0;;
7;NH/FB;Geografija;B;6;GZ1;Zemljina kretanja - prividno kretanje Sunca, rotacija Zemlje;Ne;;Ne;;Ne;;;1;NH-34-7.1a, NH-34-7.1b;;1;NH-34-7.1a, NH-34-7.1b;;0;;;0;;
8;NH/FB;Geografija;B;6;GZ1;Revolucija Zemlje;Ne;;Ne;;Ne;;;2;;;2;;;0;;;0;;
9;NH/FB;Geografija;B;6;GZ1;Toplotni pojasevi;Ne;;Ne;;Ne;;;2;;;2;;;0;;;0;;
10;NH/FB;Geografija;B;6;GZ1;Predstavljanje Zemljine površine na ravni;Ne;;Ne;;Ne;;;2;;;2;;;0;;;0;;
11;NH/FB;Geografija;B;6;GZ1;Zemlja i Zemljine sfere;Ne;;Ne;;Ne;;;2;;;2;;;0;;;0;;
12;NH/FB;Geografija;B;6;GZ1;Litosfera i kora Zemlje;Ne;;Ne;;Ne;;;2;;;2;;;0;;;0;;
13;NH/FB;Geografija;B;6;GZ1;Endogene ili unutrašnje sile;Ne;;Ne;;Ne;;;2;;;2;;;0;;;0;;
14;NH/FB;Geografija;B;6;GZ1;Egzogene ili vanjske sile;Ne;;Ne;;Ne;;;2;;;2;;;0;;;0;;
15;NH/FB;Geografija;B;6;GZ1;Atmosfera - zračni omotač Zemlje;Ne;;Ne;;Ne;;;2;;;2;;;0;;;0;;
16;NH/FB;Geografija;B;6;GZ1;Zračni pritisak - vjetar;Ne;;Da;odgovornost, zaštitaživotnesredine, život NH-69-16.1;Ne;;;2;;;2;;;0;;;0;;
17;NH/FB;Geografija;B;6;GZ1;Atmosferski procesi;Ne;;Ne;;Ne;;;2;;;2;;;0;;;0;;
18;NH/FB;Geografija;B;6;GZ1;Vrijeme i klima;Ne;;Ne;;Ne;;;2;;;2;;;0;;;0;;
19;NH/FB;Geografija;B;6;GZ1;Hidrosfera - vodeni omotač;Ne;;Ne;;Ne;;;2;;;2;;;0;;;0;;
20;NH/FB;Geografija;B;6;GZ1;Dinamika svjetskog okeana;Ne;;Da;zaštitaživotnesredine, odgovornost, život, zajedništvo NH-85-20.2;Ne;;;2;;;2;;;0;;;0;;
21;NH/FB;Geografija;B;6;GZ1;Kopnene vode;Ne;;Ne;;Ne;;;2;;;2;;;0;;;0;;
22;NH/FB;Geografija;B;6;GZ1;Tekućice;Ne;;Ne;;Ne;;;2;;;2;;;0;;;0;;
23;NH/FB;Geografija;B;6;GZ1;Jezera, močvare i bare, led na Zemlji, značaj kopnenih voda;Ne;;Da;zaštitaživotnesredine, odgovornost, zajedništvo NH-91-23.1 i NH-91-23.2;Ne;;;2;;;2;;;0;;;0;;
24;NH/FB;Geografija;B;6;GZ1;Biosfera;Ne;;Da;život, zaštitaživotnesredine NH-94-24.1;Ne;;;2;;;2;;;0;;;0;;
25;NH/FB;Geografija;B;6;GZ1;Vodene biogeografske oblasti;Ne;;Ne;;Ne;;;2;;;2;;;0;;;0;;
26;NH/FB;Geografija;B;6;GZ1;Demografske odlike na Zemlji - ekumena, porast svjetskog stanovništva;Ne;;Ne;;Ne;;;2;;;2;;;0;;;0;;
27;NH/FB;Geografija;B;6;GZ1;Prirodno kretanje stanovništva migracije - prostorno kretanje stanovništva ;Ne;;Da;jednakost, život NH-106-27.2;Ne;;;2;;;2;;;0;;;2;;NH-106-27.1
28;NH/FB;Geografija;B;6;GZ1;Strukture stanovništva;Ne;;Da;sloboda, život,  ravnopravnost NH-109-28.2, NH-109-28.3, FB-109-28.1, zajedništvo, solidarnost, odgovornost, obrazovanje NH-113-28.8, NH-113-28.11, NH-114-28.12a;Da;porijeklo;relativizacija, insinuacija, redukcija, ignorancija;0;;;0;;;2;;NH-109-28.1, NH-111-28.7, NH-113-28.10;2;;NH-113-28.9
29;NH/FB;Geografija;B;6;GZ1;Proizvodi ljudske djelatnosti na Zemlji - naselja i tipovi naselja na Zemlji;Ne;;Ne;;Ne;;;2;;;2;;;0;;;0;;
30;NH/FB;Geografija;B;6;GZ1;Privreda i privredne djelatnosti;Ne;;Da;život NH-120-30.1, zaštitaživotnesredine, odgovornost NH-122-30.2, NH-123-30.3, NH-124-30.4, NH-124-30.6, obrazovanje NH-124-30.5   ;Ne;;;2;;;2;;;0;;;0;;
31;NH/FB;Geografija;B;6;GZ1;Stepen privredne razvijenosti;Ne;;Da;saradnja, odgovornost, život FB-125, FB-126, zajedništvo, solidarnost, obrazovanje NH-125-31.1, NH-126-31.4a, NH-1263-1.4b;Ne;;;2;;;2;;;0;;;0;;
32;NH/FB;Geografija;B;6;GZ1;Geozaštita okoline - globalni aspekti života na Zemlji;Ne;;Da;odgovornost, zaštitaživotnesredine NH-130-32.1, NH-131-32.2;Ne;;;2;;;2;;;0;;;0;;
33;NH/FB;Geografija;B;6;GZ1;Ugroženi elementi životne sredine;Ne;;Da;zaštitaživotnesredine NH-133-33.1, NH-134-33.3, odgovornost, jednakost FB-134, FB-135;Ne;;;1;FB-135-1;;2;;;0;;;0;;
1;FB/AM;Geografija;B;7;GZ3;Geografski položaj, granice i veličina Evrope;Ne;;Da;život NH-7-1.1;Ne;;;2;;;2;;;0;;;2;;
2;FB/AM;Geografija;B;7;GZ3;Prirodno geografske odlike Evrope;Ne;;Ne;;Ne;;;2;;;2;;;0;;;0;;
3;FB/AM;Geografija;B;7;GZ3;Društveno-geografske odlike Evrope: Stanovništvo Evrope;Ne;;Da;saradnja FB-18;Da;pobožnost FB-18-3.1;redukcija;2;;;2;;;2;;;2;;
4;FB/AM;Geografija;B;7;GZ3;Društveno-geografske odlike Evrope: Privredni razvoj Evrope;Ne;;Da;odgovornost FB-23-4.1;Ne;;;2;;AM-22, AM-24;2;;;2;;;2;;AM-22
5;FB/AM;Geografija;B;7;GZ3;Mediteran - Sredozemlje;Ne;;Ne;;Ne;;;2;AM-26-1;;2;;;0;;;0;;
6;FB/AM;Geografija;B;7;GZ3;Evropsko Sredozemlje - Južna Evropa: Pirinejski poluotok;Ne;;Ne;;Ne;;;2;;;2;;;0;;;0;;FB-29-6.1
7;FB/AM;Geografija;B;7;GZ3;Osnovni geografski podaci o zemljama Pirinejskog poluotoka;Ne;;Ne;;Ne;;;2;;;2;;AM-31;0;;;0;;
8;FB/AM;Geografija;B;7;GZ3;Apeninski poluotok - Italija;Ne;;Ne;;Ne;;;0;;;2;;AM-32;0;;;0;;
9;FB/AM;Geografija;B;7;GZ3;Ostale zemlje Apeninskog poluotoka i Malta;Da;neravnopravnost FB-38-9.1, AM-38 ;Da;jednakost FB-38-9.1;Ne;;;1;FB-39-9.1, AM-39;;0;;;0;;;0;;
10;FB/AM;Geografija;B;7;GZ3;Balkanski poluotok - jugoistočna Evropa;Ne;;Da;mir FB-42-10.1, AM-42;Ne;;;1;FB-42-10.2;;2;;;0;;;0;;
11;FB/AM;Geografija;B;7;GZ3;Zemlje Balkanskog poluotoka;Ne;;Da;mir AM-46-1, AM-46-2, AM-49-2, odgovornost AM-49-3;Ne;;;1;AM-49-1;;2;;AM-44, AM-46-3;0;;;0;;
12;FB/AM;Geografija;B;7;GZ3;Makedonija i Albanija;Ne;;Ne;;Ne;;;2;;;2;;AM-51;0;;;0;;
13;FB/AM;Geografija;B;7;GZ3;Najveće balkanske države;Ne;;Ne;;Ne;;;1;FB-56-13.1;;2;;AM-54;0;;;0;;
14;FB/AM;Geografija;B;7;GZ3;Azijsko Sredozemlje - jugozapadna Azija: Položaj i prirodno-geografska obilježja azijskog Sredozemlja;Ne;;Da;mir FB-57-14.1, AM-57-1;Ne;;;1;AM-57-2;;1;AM-59;;0;;;0;;
15;FB/AM;Geografija;B;7;GZ3;Društveno-geografske odlike azijskog Sredozemlja;Da;potenciranjeosvajačkihpohoda AM-60;Ne;;Ne;;;2;;;2;AM-61;;2;;FB-60-15.1;2;;FB-60-15.2
16;FB/AM;Geografija;B;7;GZ3;Osnovni geografski podaci i Turskoj, Saudijskoj Arabiji i Iranu;Ne;;Ne;;Ne;;;1;FB-63-16.1;;1;AM-63;;0;;;0;;
17;FB/AM;Geografija;B;7;GZ3;Afričko Sredozemlje - sjeverna Afrika: Položaj i prirodno-geografska obilježja afričkog Sredozemlja;Ne;;Da;život AM-64;Ne;;;1;FB-65-17.1;;0;;;0;;;0;;
18;FB/AM;Geografija;B;7;GZ3;Društveno-geografske odlike afričkog Sredozemlja;Ne;;Da;život, saradnja AM-66-1, AM-66-2;Da;prošlost, teritorij FB-66-18.1;insinuacija, redukcija;0;;;0;;;0;;;0;;
19;FB/AM;Geografija;B;7;GZ3;Osnovni geografski podaci o Egiptu i Alžiru;Ne;;Ne;;Ne;;;0;;;1;AM-69;;0;;;0;;
20;FB/AM;Geografija;B;7;GZ3;Zapadna Evropa: Definicija prostora i prirodno geografske odlike zapadne Evrope;Da;promoviranjeneokolonijalizma, neravnopravnost AM-70;Ne;;Ne;;;2;;;2;;;0;;;0;;
21;FB/AM;Geografija;B;7;GZ3;Društveno-geografska obilježja zapadne Evrope;Ne;;Da;saradnja FB-73-21.1;Ne;;;2;;;2;;;0;;;2;;FB-73-21.2
22;FB/AM;Geografija;B;7;GZ3;Otočne zemlje zapadne Evrope;Ne;;Ne;;Ne;;;0;;;2;;AM-78, AM-79;0;;;0;;
23;FB/AM;Geografija;B;7;GZ3;Zemlje Beneluksa ;Ne;;Da;odgovornost FB-82-23.1, FB-83-23.2, AM-83, jednakost FB-84-23.3;Ne;;;2;;;2;;;0;;;0;;
24;FB/AM;Geografija;B;7;GZ3;Francuska i Monako;Ne;;Ne;;Ne;;;2;;;2;;AM-88-1, AM-88-22;0;;;0;;
25;FB/AM;Geografija;B;7;GZ3;Sjeverna Evropa: Položaj i prirodno-geografska obilježja sjeverne Evrope;Ne;;Ne;;Ne;;;2;;;2;;;0;;;0;;
26;FB/AM;Geografija;B;7;GZ3;Društveno-geografska obilježja sjeverne Evrope;Ne ;;Ne;;Ne;;;2;;;2;;;0;;;0;;
27;FB/AM;Geografija;B;7;GZ3;Skandinavske zemlje i Island;Ne;;Da;život, sigurnost, blagostanje FB-98-26.1, AM-99-26.2;Ne;;;0;;;2;;;0;;;0;;
28;FB/AM;Geografija;B;7;GZ3;Finska i Danska;Ne;;Ne;;Ne;;;2;;;0;AM-102; AM-100, AM-101  ;0;;;0;;
29;FB/AM;Geografija;B;7;GZ3;Pribaltičke zemlje sjeverne Evrope;Ne;;Ne;;Ne;;;2;;;2;;AM-106;2;;FB-104-29.1, FB-105-29.2;0;;
30;FB/AM;Geografija;B;7;GZ3;Srednja Evropa: Položaj i prirodno-geografska obilježja srednje Evrope;Ne;;Ne;;Ne;;;0;;;2;;;0;;;0;;
31;FB/AM;Geografija;B;7;GZ3;Društveno-geografska obilježja srednje Evrope;Ne;;Ne;;Ne;;;1;AM-111;;2;;AM-110;0;;;0;;
32;FB/AM;Geografija;B;7;GZ3;Njemačka i Poljska;Ne;;Ne;;Ne;;;2;;;2;;;0;;;0;;
33;FB/AM;Geografija;B;7;GZ3;Alpske zemlje srednje Evrope;Ne;;Ne;;Ne;;;0;;;2;;;0;;;0;;
34;FB/AM;Geografija;B;7;GZ3;Zemlje na istoku srednje Evrope;Ne;;Ne;;Ne;;;2;;;2;;;0;;;0;;
35;FB/AM;Geografija;B;7;GZ3;Istočna Evropa: Položaj i prirodno-geografska obilježja istočne Evrope;Ne;;Ne;;Ne;;;2;;;2;;;0;;;0;;
36;FB/AM;Geografija;B;7;GZ3;Društveno-geografska obilježja istočne Evrope;Ne;;Ne;;Ne;;;2;;;2;;;0;;;0;;
37;FB/AM;Geografija;B;7;GZ3;Ruska federacija - država na dva kontinenta;Ne;;Ne;;Ne;;;2;;;2;;;0;;;0;;
38;FB/AM;Geografija;B;7;GZ3;Ostale države istočne Evrope;Ne;;Ne;;Ne;;;2;;;2;;;0;;;0;;
1;NH/FB;Geografija;B;7;GZ4;Pojam, veličina, geografski smještaj i položaj Evrope;Ne;;Da;život FB-11-1.6;Ne;;;1;FB-7-1.1, FB-8-1.2, FB-8-1.3, FB-8-1.4, FB-9-1.5;;1;FB-7-1.1, FB-8-1.2, FB-8-1.3, FB-8-1.4, FB-9-1.5;;2;;NH-11-1.3;2;;NH-9-1.4a, NH-11-1.4B
2;NH/FB;Geografija;B;7;GZ4;Reljef i geološka građa Evrope;Ne;;Ne;;Ne;;;1;FB-12-2.1, FB-12-2.3, FB-14-2.4, FB-15-2.5, FB-15-2.6, FB-15-2.7 ;;1;FB-12-2.1, FB-12-2.3, FB-14-2.4, FB-15-2.5, FB-15-2.6, FB-15-2.7 ;;2;FB-12-2.2;NH-14-2.2  ;0;;
3;NH/FB;Geografija;B;7;GZ4;More i obale Evrope ;Ne;;Da;odgovornost FB-21-3.1, NH-21-3.4b, život NH-19-3.3;Ne;;;1;FB-17-3.1, FB-18-3.3, FB-18-3.4, FB-19-3.5, FB-20-3.6, FB-21-3.7 ;;1;FB-17-3.1, FB-18-3.3, FB-18-3.4, FB-19-3.5, FB-20-3.6, FB-21-3.7 ;;0;FB-17-3.2;;0;;
4;NH/FB;Geografija;B;7;GZ4;Kopnene vode Evrope;Ne;;Ne;;Ne;;;1;NH-22-4.1a, NH-22-4.1b, NH-23-4.1c, NH-23-4.1d, FB-24, NH-25-4.1e, NH-25-4.1, NH-27-4.1f ;;1;NH-22-4.1a, NH-22-4.1b, NH-23-4.1c, NH-23-4.1d, FB-24, NH-25-4.1e, NH-25-4.1, NH-27-4.1f;;0;FB-27;;0;;
5;NH/FB;Geografija;B;7;GZ4;Klima i vegetacijska područja Evrope;Ne;;Da;odgovornost NH-30-5.2;Ne;;;1;FB-28-5.1, FB-29-5.3., FB-30-5.4, FB-30-5.5, FB-31-5.6, FB-32-5.7, FB-32-5.8, FB-32-5.9, FB-33-5.10;;1;FB-28-5.1, FB-29-5.3., FB-30-5.4, FB-30-5.5, FB-31-5.6, FB-32-5.7, FB-32-5.8, FB-32-5.9, FB-33-5.10;;0;FB-29-5.2;;0;;
6;NH/FB;Geografija;B;7;GZ4;Stanovništvo Evrope - Narodi i države;Ne;;Da;jednakost, suživot, solidarnost FB-36-6.3, FB-36-6.5, NH-37-6.12, FB-38-6.7, FB-39-6.8;Da;porijeklo FB-36-6.4, NH-34-6.2;insinuacija, ignorancija;1;FB-34-1, NH-35-6.1a, FB-36-2, FB-36-3, NH-37-6.1d, FB-37-4, FB-38-5, FB-39-6, NH-39-6.1g; ;1;FB-34-1, NH-35-6.1a, FB-36-2, FB-36-3, NH-37-6.1d, FB-37-4, FB-38-5, FB-39-6, NH-39-6.1g;;0;FB-35-6.1;;0;;
7;NH/FB;Geografija;B;7;GZ4;Kretanje evropskog stanovništva;Ne;;Da;život, odgovornost FB-40-7.1, FB-41-7.2;Ne;;;1;NH-40-7.1a, NH-41-7.1b, NH-42-7.1c, NH-42-7.1d, NH-42-71.e, NH-43-7.1f;;1;NH-40-7.1a, NH-41-7.1b, NH-42-7.1c, NH-42-7.1d, NH-42-71.e, NH-43-7.1f;;0;FB-42-7.3;;0;;
8;NH/FB;Geografija;B;7;GZ4;Privreda Evrope;Ne;;Da;život FB-44-8.1, NH-45-8.2, zaštitaživotnesredine NH-46-8.3, NH-47-8.4, NH-47-8.5 ;Ne;;;1;NH-44-8.1a, NH-45-8.1b, NH-45-8.1c, NH-46-8.1d, NH-47-8.1e ;;1;NH-44-8.1a, NH-45-8.1b, NH-45-8.1c, NH-46-8.1d, NH-47-8.1e ;;0;FB-44-8.2;;0;;
9;NH/FB;Geografija;B;7;GZ4;Evropska unija;Ne;;Da;sloboda, jednakost, solidarnost, život NH-49-9.2, NH-49-9.3, NH-50-9.4, NH-50-9.5, NH-51-9.6, NH-51-9.7, NH-51-9.8;Ne;;;1;NH-49-9.1a, NH-51-9.1b;;1;NH-49-9.1a, NH-51-9.1b;;0;FB-52-9.7;;0;;
10;NH/FB;Geografija;B;7;GZ4;Sredozemlje - Mediteran: Evropsko Sredozemlje - Prirodna obilježja;Ne;;Da;saradnja FB-54-10.1, FB-56-10.2, odgovornost NH-61-10.3;Ne;;;1;NH-58-10.1a, NH-58-10.1b, NH-59-10.1c, NH-60-10.1d, NH-60-10.1e; ;1;NH-58-10.1a, NH-58-10.1b, NH-59-10.1c, NH-60-10.1d, NH-60-10.1e;;0;FB-61-10.3;;0;;
11;NH/FB;Geografija;B;7;GZ4;Evropsko Sredozemlje - Stanovništvo i privredna obilježja;Ne;;Da;odgovornost FB-66-11.2;Ne;;;1;NH-63-11.1a, NH-64-11.1b, NH-65-11.1c;;1;NH-63-11.1a, NH-64-11.1b, NH-65-11.1c;;0;FB-63-11.1;;0;;
12;NH/FB;Geografija;B;7;GZ4;Države Apeninskog poluotoka;Ne;;Da;odgovornost NH-73-12.2, NH-74-12.3;Ne;;;1;NH-68-12.1a, NH-69-12.1b, NH-69-12.1c, NH-69-12.1d, NH-70-12.1e, NH-70-12.1f, NH-71-12.1g;;1;NH-68-12.1a, NH-69-12.1b, NH-69-12.1c, NH-69-12.1d, NH-70-12.1e, NH-70-12.1f, NH-71-12.1g;;0;FB-71-12.1;;0;;
13;NH/FB;Geografija;B;7;GZ4;Države Pirinejskog poluotoka i Malta;Ne;;Ne;;Ne;;;1;NH-75-13.1a, NH-76-13.1b, NH-76-13.1c, NH-77-13.1d, NH-79-13.1e, NH-79-13.1f, NH-80-13.1g, NH-81-13.1h;;1;NH-75-13.1a, NH-76-13.1b, NH-76-13.1c, NH-77-13.1d, NH-79-13.1e, NH-79-13.1f, NH-80-13.1g, NH-81-13.1h;;0;FB-77-13.1;;0;;
14;NH/FB;Geografija;B;7;GZ4;Jugoistočna Evropa - Prirodna i društvena obilježja;Ne;;Da;odgovornost, zaštitaživotnesredine FB-90-14.2;Ne;;;1;NH-87-14.1a, NH-87-14.1b, NH-88-14.1c, NH-89-14.1d;;1;NH-87-14.1a, NH-87-14.1b, NH-88-14.1c, NH-89-14.1d;;2;;NH-89-14.3 ;0;;
15;NH/FB;Geografija;B;7;GZ4;Republika Hrvatska - Prirodna obilježja;Ne;;Da;odgovornost, zaštitaživotnesredine NH-95-15.5;Ne;;;1;NH-91-15.1a, NH-91-15.1b, NH-92-15.1.c, NH-93-15.1d, NH-93-15.1e, NH-94-15.1f;;1;NH-91-15.1a, NH-91-15.1b, NH-92-15.1.c, NH-93-15.1d, NH-93-15.1e, NH-94-15.1f;;2;FB-91-15.1;NH-91-15.2a, NH-96-15.2b, NH-96-15.2c  ;0;;NH-92-15.3
16;NH/FB;Geografija;B;7;GZ4;Republika Hrvatska - Stanovništvo i privredna obilježja;Ne;;Da;ravnopravnost, saradnja FB-98-16.1, zaštitaživotnesredine, zaštitakulturno-historijskognaslijeđa NH-100-16.5;Ne;;;1;NH-97-16.1a, NH-98-16.1b, NH-98-16.1c, NH-99-16.1d, NH-100-16.1e ;;1;NH-97-16.1a, NH-98-16.1b, NH-98-16.1c, NH-99-16.1d, NH-100-16.1e ;;0;;NH-97-16.2, NJ-98-16.4 ;0;;
17;NH/FB;Geografija;B;7;GZ4;Srbija - Prirodna obilježja;Ne;;Da;odgovornost, zaštitaživotnesredine FB-105-17.3, FB-105-17.4;Ne;;;1;NH-102-17.1a, NH-103-17.1b, NH-104-17.1c ;;1;NH-102-17.1a, NH-103-17.1b, NH-104-17.1c ;;2;;NH-103-17.2;0;;
18;NH/FB;Geografija;B;7;GZ4;Stanovništvo i regionalna obilježja Srbije;Ne;;Ne;;Ne;;;1;NH-106-18.1a, NH-108-18.1b, NH-109-18.1c ;;1;NH-106-18.1a, NH-108-18.1b, NH-109-18.1c ;;2;;NH-106-18.2a, NH-108-18.2b, NH-109-18.2c ;0;;
19;NH/FB;Geografija;B;7;GZ4;Crna Gora i Kosovo;Ne;;Da;odgovornost, zaštitaživotnesredine NH-114-19.2;Ne;;;1;NH-110-19.1a, NH-111-19.1b, NH-111-19.1c, NH-112-19.1d, NH-112-19.1e ;;1;NH-110-19.1a, NH-111-19.1b, NH-111-19.1c, NH-112-19.1d, NH-112-19.1e ;;2;;NH-110-9.4, NH-112-19.4, NH-114-19.4;0;;
20;NH/FB;Geografija;B;7;GZ4;Grčka i Albanija;Ne;;Da;odgovornost, zaštitaživotnesredine, život NH-119-20.3;Ne;;;1;NH-115-20.1a, NH-115-20.1b, NH-115-20.1c, NH-118-20.1d, NH-118-20.1e, NH-118-20.1f ;;1;NH-115-20.1a, NH-115-20.1b, NH-115-20.1c, NH-118-20.1d, NH-118-20.1e, NH-118-20.1f ;;2;FB-115;NH-119-20.4 ;0;;NH-118-20.2a, NH-119-20.2b 
21;NH/FB;Geografija;B;7;GZ4;Ruminija, Bugarska i Makedonija;Ne;;Ne;;Ne;;;1;NH-122-21.1a, NH-122-21.1b, NH-122-21.1c, NH-123-21.1d, NH-123-21.1e ;;1;NH-122-21.1a, NH-122-21.1b, NH-122-21.1c, NH-123-21.1d, NH-123-21.1e ;;0;FB-120-21.1;;0;;
22;NH/FB;Geografija;B;7;GZ4;Jugozapadna Azija - Prirodna obilježja;Ne;;Ne;;Ne;;;1;NH-128-22.1a, NH-129-22.1b, NH-129-22.1c, NH-130-22.1d, NH-131-22.1e, NH-131-22.1f, NH-132-22.1g;;1;NH-128-22.1a, NH-129-22.1b, NH-129-22.1c, NH-130-22.1d, NH-131-22.1e, NH-131-22.1f, NH-132-22.1g;;0;;;0;;
23;NH/FB;Geografija;B;7;GZ4;Jugozapadna Azija - Stanovništvo i privredna obilježja;Ne;;Da;odgovornost NH-137-23.7;Ne;;;1;NH-133-23.1a, NH-135-23.1b, NH-135-23.1c, NH-137-23.1d, NH-137-23.1e, NH-137-23.1f;;1;NH-133-23.1a, NH-135-23.1b, NH-135-23.1c, NH-137-23.1d, NH-137-23.1e, NH-137-23.1f;;2;;NH-133-23.3 ;2;;NH-133-23.3, NH-133-23.4, NH-137-23.5, NH-137-23.6
24;NH/FB;Geografija;B;7;GZ4;Turska, Saudijska Arabija i Iran;Ne;;Da;odgovornost NH-141-24.2, NH-143.24.4;Ne;;;1;NH-139-24.1a, NH-139-24.1b;;1;NH-139-24.1a, NH-139-24.1b;;0;FB-138-24.1;;0;;
25;NH/FB;Geografija;B;7;GZ4;Afričko Sredozemlje - Prirodna i društvena obilježja ;Ne;;Da;odgovornost NH-150-25.4;Ne;;;1;NH-146-25.1a, NH-147-25.1b, NH-147-25.1c;;1;NH-146-25.1a, NH-147-25.1b, NH-147-25.1c;;2;FB-146-25.1;NH-147-25.2 ;0;;
26;NH/FB;Geografija;B;7;GZ4;Egipat;Ne;;Ne;;Ne;;;1;FB-151-2, FB-151-3, FB-153-4, FB-153-5;;1;FB-151-2, FB-151-3, FB-153-4, FB-153-5;;0;FB-151-1;;2;;FB-154, FB-155 
27;NH/FB;Geografija;B;7;GZ4;Sjeverna Evropa - Prirodna i društvena obilježja;Ne;;Da;saradnja, zajedništvo NH-162-27.2;Ne;;;1;NH-158-27.1a, NH-158-27.1b, NH-159-27.1c, NH-160-27.1d;;1;NH-158-27.1a, NH-158-27.1b, NH-159-27.1c, NH-160-27.1d;;0;FB-158-27.1;;0;;
28;NH/FB;Geografija;B;7;GZ4;Skandinavske države;Ne;;Da;ravnopravnost NH-166-28.2;Ne;;;1;NH-163-28.1a, NH-164-28.1b, NH-164-28.1c, NH-166-28.1d, NH-166-28.1e, NH-166-28.1f;;1;NH-163-28.1a, NH-164-28.1b, NH-164-28.1c, NH-166-28.1d, NH-166-28.1e, NH-166-28.1f;;0;FB-165-28.1;NH-167-28.3;0;;
29;NH/FB;Geografija;B;7;GZ4;Ostale države Sjeverne Evrope;Ne;;Ne;;Ne;;;1;NH-168-29.1a, NH-169-29.1b, NH-170-29.1c, NH-171-29.1d, NH-172-29.1e, NH-172-29.1f;;1;NH-168-29.1a, NH-169-29.1b, NH-170-29.1c, NH-171-29.1d, NH-172-29.1e, NH-172-29.1f;;0;FB-168-29.1;;0;;
30;NH/FB;Geografija;B;7;GZ4;Zapadna Evropa - Prirodna i društvena obilježja;Ne;;Ne;;Ne;;;1;NH-176-30.1a, NH-177-30.1b, NH-177-30.1c, NH-179-30.1d, NH-179-30.1e;;1;NH-176-30.1a, NH-177-30.1b, NH-177-30.1c, NH-179-30.1d, NH-179-30.1e;;0;FB-176-30.1;;0;;
31;NH/FB;Geografija;B;7;GZ4;Ujedinjeno Kraljevstvo ;Ne;;Ne;;Ne;;;1;NH-181-31.1a, NH-186-31.1b, FB-187-1;;1;NH-181-31.1a, NH-186-31.1b, FB-187-1;;0;FB-181-31.1;;2;;NH-186-31.3a, NH-187-31.3b
32;NH/FB;Geografija;B;7;GZ4;Francuska;Ne;;Da;odgovornost, zaštitaživotnesredine NH-195-32.5;Ne;;;1;NH-188-32.1a, NH-189-32.1b, NH-190-32.1c, NH-190-32.1d, NH-192-32.1e;;1;NH-188-32.1a, NH-189-32.1b, NH-190-32.1c, NH-190-32.1d, NH-192-32.1e;;0;FB-188-32.1;;0;;
33;NH/FB;Geografija;B;7;GZ4;Ostale države Zapadne Evrope;Ne;;Ne;;Ne;;;1;NH-196-33.1a, NH-197-33.1b, NH-200-33.1c, NH-201-33.1d, FB-203-1;;1;NH-196-33.1a, NH-197-33.1b, NH-200-33.1c, NH-201-33.1d, FB-203-1;;0;FB-196-33.1;;0;;
34;NH/FB;Geografija;B;7;GZ4;Srednja Evropa - Prirodna i društvena obilježja;Ne;;Ne;;Ne;;;1;NH-206-34.1a, NH-207-34.1b, NH-208-34.1c;;1;NH-206-34.1a, NH-207-34.1b, NH-208-34.1c;;2;;NH-207-34.2;0;;
35;NH/FB;Geografija;B;7;GZ4;Njemačka;Ne;;Da;saradnja, sloboda NH-211-35.2a, NH-211-35.2b, odgovornost, život FB-213-35.1, FB-213-35.2, NH-213-35.3, NH-215-35.4;Ne;;;1;NH-211-35.1a, NH-211-35.1b, NH-212-35.1c, NH-213-35.1d, NH-214-35.1e;;1;NH-211-35.1a, NH-211-35.1b, NH-212-35.1c, NH-213-35.1d, NH-214-35.1e;;0;;;0;;
36;NH/FB;Geografija;B;7;GZ4;Alpske države;Ne;;Da;odgovornost, mir, jednakost FB-218-36.2, FB-219-36.3, FB-219-36.4;Ne;;;1; NH-218-36.1a, NH-218-36.1b, NH-219-36.1c, NH-219-36.1d, NH-221-36.1e, NH-221-36.1f, NH-223-36.1g, NH-224-36.1h;;1; NH-218-36.1a, NH-218-36.1b, NH-219-36.1c, NH-219-36.1d, NH-221-36.1e, NH-221-36.1f, NH-223-36.1g, NH-224-36.1h;;2;FB-218-36.1;NH-222-36.6a, NH-224-36.6b ;0;;
37;NH/FB;Geografija;B;7;GZ4;Ostale države Srednje Evrope;Ne;;Da;odgovornost, zaštitaživotnesredine, mir FB-226-37.2, FB-227-37.3, NH-231-37.4;Ne;;;1;NH-225-37.1a, NH-227-37.1b, NH-230-37.1c, NH-230-37.1d;;1;NH-225-37.1a, NH-227-37.1b, NH-230-37.1c, NH-230-37.1d;;0;FB-225-37.1;;0;;
38;NH/FB;Geografija;B;7;GZ4;Istočna Evropa - Prirodna i društvena obilježja;Ne;;Ne;;Ne;;;1;NH-234-38.1a, NH-235-38.1b, NH-236-38.1c, NH-237-38.1d;;1;NH-234-38.1a, NH-235-38.1b, NH-236-38.1c, NH-237-38.1d;;0;FB-234-38.1;;0;;
39;NH/FB;Geografija;B;7;GZ4;Ruska federacija;Da;rat, napetost NH-242-39.2;Ne;;Ne;;;1;NH-239-39.1a, NH-239-39.1b, NH-240-39.1c, NH-241-39.1d, NH-243-39.1e, NH-244-39.1f;;1;NH-239-39.1a, NH-239-39.1b, NH-240-39.1c, NH-241-39.1d, NH-243-39.1e, NH-244-39.1f;;0;FB-239-39.1;;0;;
40;NH/FB;Geografija;B;7;GZ4;Ostale države istočne Evrope;Ne;;Da;odgovornost, život, zaštitaživotnesredine FB-249-40.2, NH-249-40.3, NH-249-40.4;Ne;;;1;NH-245-40.1a, NH-245-40.1b, NH-246-40.1c, NH-246-40.1d, NH-247-40.e, NH-248-40.1f;;1;NH-245-40.1a, NH-245-40.1b, NH-246-40.1c, NH-246-40.1d, NH-247-40.e, NH-248-40.1f;;0;FB-245-40.1;;0;;
1;AM/NH;Geografija;B;8;GZ5;Prirodnogeografske odlike Azije - Naziv, Granice i Geografski položaj ;Ne;;Ne;;Ne;;;1;NH-6-1.1a, NH-6-1.1b, NH-6-1.1c, NH-6-1.1d, NH-7-1.1e, NH-8-1.1f, NH-10-1.1g, NH-11-1.1h, NH-11-1.1i, NH-12-1.1j, AM-15-1;;1;NH-6-1.1a, NH-6-1.1b, NH-6-1.1c, NH-6-1.1d, NH-7-1.1e, NH-8-1.1f, NH-10-1.1g, NH-11-1.1h, NH-11-1.1i, NH-12-1.1j;AM-7-1, AM-14-1;0;;;0;;
2;AM/NH;Geografija;B;8;GZ5;Društvenogeografske odlike Azije;Da;pluralizamkaoproblem AM-18-1;Ne;;Ne;;;1;NH-17-2.1a, NH-17-2.1b, NH-17-2.1c;;1;NH-17-2.1a, NH-17-2.1b, NH-17-2.1c;AM-18-2;2;;NH-18-2.2;2;;NH-18-2.3
3;AM/NH;Geografija;B;8;GZ5;Regionalna podjela Azije - Centralna Azija;Ne;;Ne;;Ne;;;1;NH-23-3.1a, NH-24-3.1b, NH-25-3.1c, NH-25-3.1d;;1;NH-23-3.1a, NH-24-3.1b, NH-25-3.1c, NH-25-3.1d, AM-31-3;AM-25-1, AM-26-2;2;;NH-27-3.4, NH-27-3.5, NH-29-3.6;0;;
4;AM/NH;Geografija;B;8;GZ5;Monsunska Azija - Geografski položaj, Prirodno geografske odlike;Ne;;Da;odgovornost, zaštitaživotnesredine NH-35-4.5;Ne;;;1;NH-32-4.1a, NH-35-4.1b;;2;;AM-35-1.2;0;;;0;;
5;AM/NH;Geografija;B;8;GZ5;Društvenogeografske odlike;Ne;;Da;život, sloboda NH-39-4.11a, NH-40-4.11b;Ne;;;1; NH-38-4.1c, AM-43-1;;0;;;0;;;0;;
6;AM/NH;Geografija;B;8;GZ5;Indija, Indonezija i Malezija ;Ne;;Ne;;Ne;;;1;NH-49-5.1a, NH-51-5.1b;;1;NH-49-5.1a, NH-51-5.1b;AM-47-1, AM-50-2;2;;NH-46-5.5 ;2;;NH-46-5.4
7;AM/NH;Geografija;B;8;GZ5;Daleki istok;Ne;;Da;odgovornost NH-60-6.6;Ne;;;1;NH-55-6.1a, NH-59-6.1b;;1;NH-55-6.1a, NH-59-6.1b;;2;;NH-60-6.5;0;;
8;AM/NH;Geografija;B;8;GZ5;Kina, Japan;Ne;;Da;odgovornost AM-65-1, NH-65-7.3;Ne;;;1;NH-67-7.1a, NH-67-7.1b, AM-70-1;;1;NH-67-7.1a, NH-67-7.1b;;2;;NH-68-7.6a, NH-68-7.6b ;0;;
9;AM/NH;Geografija;B;8;GZ5;Afrika - Prirodnogeografske odlike;Ne;;Ne;;Ne;;;1;NH-72-8.1a, NH-73-8.1b, NH-73-8.1c, NH-74-8.1d, NH-74-8.1e, NH-75-8.1f, NH-77-8.1g, NH-78-8.1h, NH-78-8.1i, NH-78-8.1j;;1;NH-72-8.1a, NH-73-8.1b, NH-73-8.1c, NH-74-8.1d, NH-74-8.1e, NH-75-8.1f, NH-77-8.1g, NH-78-8.1h, NH-78-8.1i, NH-78-8.1j;AM-79-1;1;NH-72-8.3a, NH-72-8.3b;;0;;
10;AM/NH;Geografija;B;8;GZ5;Društvenogeografske odlike;Da;pluralizamkaoproblem AM-82-1;Da;odgovornost NH-83-9.5a, NH-85-9.5b;Ne;;;1;NH-81-9.1a, NH-83-9.1b, NH-85-9.1c, NH-85-9.1d;;1;NH-81-9.1a, NH-83-9.1b, NH-85-9.1c, NH-85-9.1d, AM-81-1;;2;;NH-82-9.3 ;2;;NH-82-9.3 
11;AM/NH;Geografija;B;8;GZ5;Zapadna Afrika - Nigerija;Ne;;Da;odgovornost NH-88-10.1, NH-89-10.2, NH-89-10.3, NH-90-10.4;Ne;;;2;;;2;;AM-88-1, AM-89-1, AM-92-1;0;;;0;;
12;AM/NH;Geografija;B;8;GZ5;Srednja Afrika;Ne;;Ne;;Ne;;;2;;;2;;;2;;NH-96-11.2 ;2;;NH-96-11.2, NH-96-11.3
13;AM/NH;Geografija;B;8;GZ5;Istočna Afrika - Etiopija;Ne;;Da;odgovornost, zaštitaživotnesredine NH-101-12.1a, NH-101-12.1b;Ne;;;2;;;2;;;0;;;0;;
14;AM/NH;Geografija;B;8;GZ5;Južna Afrika;Ne;;Ne;;Ne;;;1;NH-106-13.1a, NH-106-13.1b, NH-108-13.1c;;1;NH-106-13.1a, NH-106-13.1b, NH-108-13.1c;;0;;;2;;NH-108-13.2a NH-110-13.2b, NH-109-13.3
15;AM/NH;Geografija;B;8;GZ5;Republika Južna Afrika;Ne;;Da;ravnopravnost NH-112-14.2a, NH-116-14.2b, NH-116-14.2c;Ne;;;1;NH-111-14.1a;;1;NH-111-14.1a;;0;;;2;;AM-111-1
16;AM/NH;Geografija;B;8;GZ5;Amerika - Prirodnogeografske odlike;Ne;;Ne;;Ne;;;1;NH-118-15.1a, NH-118-15.1b, NH-118-15.1c, NH-121-15.1d;;1;NH-118-15.1a, NH-118-15.1b, NH-118-15.1c, NH-121-15.1d;AM-125-1;0;;;0;;
17;AM/NH;Geografija;B;8;GZ5;Amerika - Društvenogeografske odlike;Da;neprijateljstvo, eksploatacija, represija AM-128-1, AM-128-2;Da;život AM-131-1, saradnja  AM-131-2, solidarnost AM-131-3, NH-134-16.10, mir AM-132-4;Ne;;;2;;AM-128-3;2;;AM-134-1;2;;AM-127-1 ;0;;
18;AM/NH;Geografija;B;8;GZ5;SAD, Kanada;Ne;;Da;zajedništvo NH-136-17.1a, NH-136-17.1b, odgovornost NH-138-17.2, ravnopravnost NH-140-17.3, saradnja NH-140-17.4;Ne;;;2;;;2;;AM-136-1, AM-137-2;0;;;0;;
19;AM/NH;Geografija;B;8;GZ5;Brazil, Argentina, Čile;Ne;;Ne;;Ne;;;1;NH-143-18.1a, NH-143-18.1b;;1;NH-143-18.1a, NH-143-18.1b, AM-143-1;;0;;;2;;NH-143-18.5
20;AM/NH;Geografija;B;8;GZ5;Australija;Ne;;Ne;;Ne;;;1;NH-150-19.1a, NH-151-19.1b, NH-152-19.1c, NH-152-19.1d, NH-152-19.1e, NH-154-19.1f;;1;NH-150-19.1a, NH-151-19.1b, NH-152-19.1c, NH-152-19.1d, NH-152-19.1e, NH-154-19.1f;AM-151-1;0;;;2;;AM-154-1
21;AM/NH;Geografija;B;8;GZ5;Okeanija;Ne;;Ne;;Ne;;;1;NH-158-20.1a, NH-158-20.1b;;1;NH-158-20.1a, NH-158-20.1b;;0;;;2;;NH-158-20.3
22;AM/NH;Geografija;B;8;GZ5;Polarne oblasti;Ne;;Da;saradnja, zaštitaživotnesredine NH-165-21.2, NH-165-21.3;Ne;;;1;NH-162-21.1a, NH-163-21.1b, NH-164-21.1c, NH-164-21.1d;;1;NH-162-21.1a, NH-163-21.1b, NH-164-21.1c, NH-164-21.1d;;0;;;0;;
1;FB/AM;Geografija;B;8;GZ6;Prirodnogeografske odlike Azije;Ne;;Ne;;Ne;;;2;;;2;;AM-6-1, AM-8-2;0;;;0;;
2;FB/AM;Geografija;B;8;GZ6;Društvenogeografske odlike Azije;Ne ;;Ne;;Ne;;;1;AM-13-1;;2;;AM-11-1;0;;;0;;
3;FB/AM;Geografija;B;8;GZ6;Centralna Azija;Ne;;Da;odgovornost, zaštitaživotnesredine FB-17-3.2;Ne;;;0;;;2;;;0;;;2;;AM-16-1
4;FB/AM;Geografija;B;8;GZ6;Monsunska Azija;Ne;;Ne;;Ne;;;0;;;2;;AM-19-1, AM-23-1, AM-23-2;0;;;0;;
5;FB/AM;Geografija;B;8;GZ6;Osnovni geografski podaci o Indiji i Maleziji;Ne;;Da;jednakost FB-27-5.2;Ne;;;0;;;2;AM-27-1;AM-24-1, AM-26-2 ;0;;;2;;AM-24-1
6;FB/AM;Geografija;B;8;GZ6;Daleki istok - Istočna Azija;Ne;;Ne;;Ne;;;0;;;2;;;2;;;0;;
7;FB/AM;Geografija;B;8;GZ6;Osnovni geografski podaci o Kini i Japanu;Ne;;Ne;;Ne;;;2;;;2;;AM-33-1, AM-34-2;2;;AM-33-1, AM-35-1;2;;
8;FB/AM;Geografija;B;8;GZ6;Afrika - Položaj i prirodnogeografska obilježja;Ne;;Ne;;Ne;;;2;;;2;;AM-38-1;2;;;2;;
9;FB/AM;Geografija;B;8;GZ6;Stanovništvo i privreda Afrike;Ne;;Da;život AM-41-1, mir AM-41-2;Ne;;;1;AM-43-1;;2;;AM-40-1;2;;;2;;FB-40-9.1
10;FB/AM;Geografija;B;8;GZ6;Ekvatorijalna Afrika;Ne;;Ne;;Ne;;;0;;;2;;;2;;;2;;
