20;FB/AM;Geografija;H;6;GZ16;Temperatura zraka i padaline;Ne;;Ne;;Ne;;;0;;;1;FB-102-20.1;;0;;;0;;
21;FB/AM;Geografija;H;6;GZ16;Tlak zraka i vjetar;Ne;;Ne;;Ne;;;0;;;1;FB-107-21.1;;0;;;0;;
22;FB/AM;Geografija;H;6;GZ16;Tropske klime;Ne;;Ne;;Ne;;;0;;;0;;;0;;;0;;
23;FB/AM;Geografija;H;6;GZ16;Suhe klime;Ne;;Ne;;Ne;;;0;;;0;;;0;;;0;;
24;FB/AM;Geografija;H;6;GZ16;Umjerene klime;Ne;;Da;odgovornost AM-116-1;Ne;;;0;;;0;;;0;;;0;;
25;FB/AM;Geografija;H;6;GZ16;Snježno-šumske i polarna klima;Ne;;Ne;;Ne;;;0;;;0;;;0;;;0;;
26;FB/AM;Geografija;H;6;GZ16;Tlo;Ne;;Da;odgovornost FB-123-26.1;Ne;;;0;;;1;FB-123-26.2;;0;;;0;;
27;FB/AM;Geografija;H;6;GZ16;Naseljenost u svijetu;Ne;;Ne;;Ne;;;1;FB-125-27.1;;0;;;0;;;0;;
28;FB/AM;Geografija;H;6;GZ16;Kretanje stanovništva;Ne;;Ne;;Ne;;;0;;;0;;;0;;;2;;AM-128-2, AM-132-2.1
29;FB/AM;Geografija;H;6;GZ16;Obilježja ljudi;Ne;;Da;jednakost, sloboda FB-134-29.2, FB-132-29.3;Ne;;;1;FB-133-29.1;;0;;;0;;;0;;
30;FB/AM;Geografija;H;6;GZ16;Gospodarske razlike;Ne;;Da;saradnja, odgovornost FB-137-30.1;Ne;;;1;FB-137-30;;0;;;0;;;0;;
31;FB/AM;Geografija;H;6;GZ16;Prirodna bogatstva i izvori energije;Ne;;Ne;;Ne;;;0;;;0;;;0;;;0;;
32;FB/AM;Geografija;H;6;GZ16;Problemi okoliša;Ne;;Da;saradnja FB-146-32.2;Ne;;;1;FB-146-32.1;;0;;;0;;;0;;
33;FB/AM;Geografija;H;6;GZ16;Moj zavičaj  ;Ne;;Da;odgovornost, zaštitaživotnesredine FB-151-33.1;Ne;;;1;FB-149-33;;1;FB-149-33;;1;AM-149-3;;1;AM-149-3;
34;FB/AM;Geografija;H;6;GZ16;Moja Herzegovina;Ne;;Ne;;Ne;;;0;;;0;;;2;;FB-155-34.1, FB-156-24.2;2;;FB-156-34.2
35;FB/AM;Geografija;H;6;GZ16;Ljepote središnje Bosne;Ne;;Ne;;Ne;;;0;;;0;;;0;;;0;;
36;FB/AM;Geografija;H;6;GZ16;Zaštita šuma;Ne;;Da;odgovornost, saradnja FB-161-36.2, FB-162-36.3;Ne;;;1;FB-160-36.1;;1;FB-161-36.2;;0;;;0;;
37;FB/AM;Geografija;H;6;GZ16;Vode;Ne;;Da;odgovornost, život FB-163-37.2, FB-164-37.3;Ne;;;1;FB-163-37.1;;1;FB-163-37.2;;0;;;0;;
1;AM/NH;Geografija;H;8;GZ25;Geografski i prometni položaj Republike Hrvatske;Ne;;Ne;;Ne;;;0;;;0;;;0;;;2;;NH-9-1.1, NH-10-1.2
2;AM/NH;Geografija;H;8;GZ25;Veličina, granice i oblik teritorija Republike Hrvatske;Ne;;Ne;;Ne;;;0;;;1;NH-15-2.2, NH-12-2;;0;;;0;;NH-14-2.1
3;AM/NH;Geografija;H;8;GZ25;Reljef Republike Hrvatske;Ne;;Ne;;Ne;;;0;;;0;;;0;;;0;;
4;AM/NH;Geografija;H;8;GZ25;Nizine i pobrđa Hrvatske;Ne;;Ne;;Ne;;;0;;;0;;;0;;;0;;
5;AM/NH;Geografija;H;8;GZ25;Klima, tlo i biljni pokrov Republike Hrvatske;Ne;;Da;odgovornost, zaštitaživotnesredine NH-28-5.1;Ne;;;0;;;0;;;0;;;0;;
6;AM/NH;Geografija;H;8;GZ25;Rijeke i jezera Hrvatske;Ne;;Ne;;Ne;;;0;;;0;;;0;;;0;;
7;AM/NH;Geografija;H;8;GZ25;Broj stanovnika Republike Hrvatske i njegov razmještaj;Ne;;Ne;;Ne;;;0;;;1;AM-36-1.1;;0;;;0;;
8;AM/NH;Geografija;H;8;GZ25;Strukture stanovništva Republike Hrvatske;Da;rat, neprijateljstvo, represija AM-41-1.2;Da;saradnja, suživot, odgovornost NH-41-8.1;Ne;;;0;;;0;;;0;;;0;;
9;AM/NH;Geografija;H;8;GZ25;Prirodno i prostorno kretanje stanovništva Republike Hrvatske;Ne;;Ne;;Ne;;;0;;;0;;;0;;;0;;
10;AM/NH;Geografija;H;8;GZ25;Geografska raznolikost Republike Hrvatske;Ne;;Ne;;Ne;;;0;;;0;;;0;;;0;;
11;AM/NH;Geografija;H;8;GZ25;Jadransko more i otoci;Ne;;Ne;;Ne;;;0;;;0;;;2;;NH-57-11.3;0;;
12;AM/NH;Geografija;H;8;GZ25;Gospodarstvo Primorske Hrvatske;Ne;;Ne;;Ne;;;0;;;0;;;0;;;0;;
13;AM/NH;Geografija;H;8;GZ25;Prirodna i kulturna baština, naselja Primorske Hrvatske;Ne;;Da;zaštitaživotnesredine, odgovornost NH-62-13.1;Ne;;;0;;;0;;;0;;;0;;
14;AM/NH;Geografija;H;8;GZ25;Gospodarstvo i naselja Gorske Hrvatske;Ne;;Ne;zaštita prirode, odgovornost NH-62-13.1;Ne;;;0;;;0;;;0;;;0;;
15;AM/NH;Geografija;H;8;GZ25;Prirodna i kulturna baština Gorske Hrvatske;Ne;;Da;zaštitaživotnesredine, odgovornost NH-72-15.1;Ne;;;1;NH-75-15.2;;0;;;0;;;0;;
16;AM/NH;Geografija;H;8;GZ25;Gospodarstvo i naselja Nizinske Hrvatske;Ne;;Ne;;Ne;;;0;;;0;;;0;;;0;;
17;AM/NH;Geografija;H;8;GZ25;Prirodna i kulturna baština Nizinske Hrvatske;Ne;;Da;odgovornost NH-82-17.1;Ne;;;0;;;0;;;0;;;0;;
18;AM/NH;Geografija;H;8;GZ25;Bosna i Hercegovina - podrijetlo imena i povijesno-teritorijalni razvoj;Ne;;Ne;;Ne;;;0;;;0;;;1;NH-88-18.1;;0;;
19;AM/NH;Geografija;H;8;GZ25;Od dolaska Slavena do danas;Ne;;Ne;;Ne;;;0;;;0;;;2;;NH-92-19.2a, NH-92-19.2b, NH-93-19.3b, NH-92-19.3a, NH-95-19.7, NH-95-19.8;0;;
20;AM/NH;Geografija;H;8;GZ25;Veličina, granice i oblik teritorija Bosne i Hercegovine;Ne;;Ne;;Ne;;;0;;;0;;;0;;;0;;
21;AM/NH;Geografija;H;8;GZ25;Reljef Bosne i Hercegovine;Ne;;Da;odgovornost, zaštitaživotnesredine AM-104-3;Ne;;;0;;;0;;;0;;;0;;
22;AM/NH;Geografija;H;8;GZ25;Klima Bosne i Hercegovine;Ne;;Ne;;Ne;;;0;;;0;;;0;;;0;;
23;AM/NH;Geografija;H;8;GZ25;Tla Bosne i Hercegovine;Ne;;Da;odgovornost AM-113-4;Ne;;;0;;;0;;;0;;;0;;
24;AM/NH;Geografija;H;8;GZ25;Biljni i životinjski svijet te ekološki problemi;Ne;;Da;odgovornost, zaštitaživotnesredine NH-117-24.1, NH-117-24.2, MH-117-24.3;Ne;;;0;;;0;;;0;;;0;;
25;AM/NH;Geografija;H;8;GZ25;Vode Bosne i Hercegovine;Ne;;Ne;;Ne;;;0;;;0;;;0;;;0;;
26;AM/NH;Geografija;H;8;GZ25;Stanovništvo Bosne i Hercegovine - broj i razmještaj;Ne;;Da;ratkaozlo NH-125-26.3;Ne;;;0;;;0;;;2;;NH-122-26.1, NH-124-26.2;0;;
27;AM/NH;Geografija;H;8;GZ25;Struktura stanovništva Bosne i Hercegovine;Ne;;Da;pluralizam, ratkaozlo NH-128-27.5, NH-131-27.7;Ne;;;0;;;0;;;2;;NH-128-27.1, NH-129-27.2, NH-128-27.4;2;;NH-128-27.3
28;AM/NH;Geografija;H;8;GZ25;Prirodno i prostorno kretanje stanovništva  ;Ne;;Da;ratkaozlo AM-133-1.3;Ne;;;0;;;0;;;2;;NH-132-28.1, NH-132-28.2, NH-133-28.3, NH-133-28.4, NH-134-28.5;0;;
29;AM/NH;Geografija;H;8;GZ25;Tipovi naselja Bosne i Hercegovine - seoska i gradska;Ne;;Ne;;Ne;;;0;;;0;;;2;;NH-136-29.1;0;;
30;AM/NH;Geografija;H;8;GZ25;Gospodarstvo Bosne i Hercegovine;Ne;;Da;ratkaozlo, odgovornost, život NH-140-30.1, AM-143-6;Ne;;;0;;;0;;;2;;NH-142-30.2a, NH-142-30.2b, NH-142-30.2c, NH-143-30.3;0;;
31;AM/NH;Geografija;H;8;GZ25;Prirodno-geografske cjeline Bosne i Hercegovine - Sjeverna Bosna;Da;pluralizamkaoproblem NH-147-31.3;Da;saradnja NH-147-31.3, AM-148-8;Da;porijeklo, tlo, prošlost AM-147-7;insinuacija;0;;;0;;;2;;NH-147-31.2;0;;
32;AM/NH;Geografija;H;8;GZ25;Srednja Bosna;Ne;;Ne;;Ne;;;0;;;0;;;0;;;0;;
33;AM/NH;Geografija;H;8;GZ25;Regija visokog krša;Ne;;Ne;;Ne;;;0;;;0;;;0;;;0;;
34;AM/NH;Geografija;H;8;GZ25;Niska Hercegovina;Ne;;Ne;;Ne;;;0;;;0;;;0;;;0;;
35;AM/NH;Geografija;H;8;GZ25;Onečišćenje i zaštita prirodnog okoliša;Ne;;Da;odgovornost, zaštitaživotnesredine NH-164-35.1, NH-165-35.1;Ne;;;0;;;0;;;0;;;0;;
36;AM/NH;Geografija;H;8;GZ25;Republika Crna Gora;Ne;;Da;odgovornost, zaštitaživotnesredine NH-169-36.2, NH-170-36.3;Ne;;;0;;;0;;;0;;;0;;
37;AM/NH;Geografija;H;8;GZ25;Republika Srbija;Ne;;Da;odgovornost, zaštitaživotnesredine NH-175-37.2;Ne;;;0;;;0;;;0;;;0;;
38;AM/NH;Geografija;H;8;GZ25;Povijesni razvoj, stanovništvo i gospodarstvo Srbije;Ne;;Da;ratkaozlo AM-178-1;Ne;;;0;;;0;;;0;;;0;;
1;FB/AM;Geografija;H;8;GZ27;Položaj i prirodna obilježja Jugoistočne Evrope;Ne;;Ne;;Ne;;;2;;;0;;;2;;FB-9-1.1, FB-12-1.2;0;;
2;FB/AM;Geografija;H;8;GZ27;Stanovništvo i gospodarstvo  ;Ne;;Ne;;Ne;;;0;;;0;;;2;;FB-14-2.2;0;;
3;FB/AM;Geografija;H;8;GZ27;Položaj, veličina i granice Republike Hrvatske;Da;neravnopravnost, neprijateljstvo FB-18-3.1;Ne;;Ne;;;1;FB-16-1.1, FB-16-1.2, FB-16-1.3, FB-16-1.4, FB-18-1.5;;0;;;0;;;0;;
4;FB/AM;Geografija;H;8;GZ27;Prirodna osnovica Hrvatske;Ne;;Da;odgovornost FB-22-4.1, FB-22-4.2;Ne;;;1;FB-20-4.1a, FB-20-4.1b, FB-20-4.1c, FB-21-4.1d, FB-21-4.1e, FB-21-4.1f;;0;;;0;;;0;;
5;FB/AM;Geografija;H;8;GZ27;Stanovništvo Hrvatske;Ne;;Da;odgovornost AM-23-1.1;Ne;;;1;FB-23-5.1a, FB-24-5.1b, FB-25-5.1c, FB-25-5.1d, FB-26-5.1e;;0;;;0;;;2;;FB-26-5.1, FB-27-5.2
6;FB/AM;Geografija;H;8;GZ27;Gospodarstvo Hrvatske;Da;neprijateljstvo FB-29-6.2, FB-29-6.3;Da;ratkaozlo AM-29-2.1;Da;teritorij;redukcija, imputacija, insinuacija;0;;;0;;;2;;FB-29-6.2, FB-29-6.3;2;;FB-28-6.1
7;FB/AM;Geografija;H;8;GZ27;Zemljopisne raznolikosti;Ne;;Ne;;Ne;;;0;;;0;;;0;;;0;;
8;FB/AM;Geografija;H;8;GZ27;Srbija i Crna Gora - Položaj, veličina i granice;Da;neprijateljstvo FB-34-8.1, FB-35-8.4, FB-35-8.5;Ne;;Ne;;;1;FB-35-8.2a, FB-35-8.2b;;0;;;2;;FB-35-8.3a;2;;FB-34-8.2, FB-34-8.3
9;FB/AM;Geografija;H;8;GZ27;Prirodna osnovica  ;Ne;;Ne;;Ne;;;1;FB-37-9.1, FB-37-9.2, FB-38-9.3, FB-38-9.4. FB-38-9.5;;0;;;0;;;0;;
10;FB/AM;Geografija;H;8;GZ27;Stanovništvo;Ne;;Da;odgovornost FB-39-10.1;Ne;;;0;;;0;;;2;;FB-39-10.2, FB-40-10.3;0;;
11;FB/AM;Geografija;H;8;GZ27;Zemlja gospodarske raznolikosti i pejzaža;Da;rat, neprijateljstvo FB-41-11.1, FB-42-11.2;Ne;;Ne;;;1;FB-41-11.3, FB-42-11.4;;0;;;2;;FB-41-11.1;2;;FB-41-11.1
12;FB/AM;Geografija;H;8;GZ27;Bosna i Hercegovina - Moja, tvoja i njegova domovina - Naša država Bosna i Hercegovina;Da;neravnopravnost FB-45-12.3;Ne;;Ne;;;0;;;0;;;2;;FB-43-12.2, FB-45-12.3, FB-45-12.4, FB-45-12.5;2;;FB-43-12.2, FB-45-12.4
13;FB/AM;Geografija;H;8;GZ27;Slavensko razdoblje;Da;neravnopravnost FB-46-13.1, FB-48-13.7, FB-48-13.8, FB-48-13.9;Ne;;Ne;;;0;;;0;;;2;;FB-46-13.2, FB-47-13.3, FB-48-13.6, FB-48-13.7;0;;
14;FB/AM;Geografija;H;8;GZ27;Položaj, veličina i granice Bosne i Hercegovine;Da;negativanodnospremaBiH FB-51-14.1, FB-51-14.3, FB-51-14.4;Da;saradnja, pluralizam FB-51-14.3, FB-51-14.4;Da;teritorij, prošlost;imputacija;1;FB-50-14.1a, FB-51-14.1b, FB-51-14.1c, FB-52-14.1d;;0;;;2;;FB-51-14.1, FB-51-14.2;2;;FB-51-14.2
15;FB/AM;Geografija;H;8;GZ27;Prirodno-zemljopisne obilježbe Bosne i Hercegovine;Ne;;Ne;;Ne;;;0;;;0;;;0;;;0;;
16;FB/AM;Geografija;H;8;GZ27;Reljef Bosne i Hercegovine;Da;prisvajanjeteritorijapoetničkojosnovi FB-58-16.1;Ne;;Ne;;;1;FB-57-16.2, FB-57-16.3, FB-58-16.4, FB-59-16.5;;0;;;0;;;0;;
17;FB/AM;Geografija;H;8;GZ27;Klima i podenblje Bosne i Hercegovine;Ne;;Ne;;Ne;;;1;FB-60-17.1a, FB-61-17.1b, FB-62-17.1C, FB-63-17.1e, FB-63-17.1d, FB-64-17.1f ;;0;;;0;;;0;;
18;FB/AM;Geografija;H;8;GZ27;Vode Bosne i Hercegovine;Ne;;Da;odgovornost FB-69-18.3;Ne;;;1;FB-66-18.1a, FB-67-18.2b;;0;;;0;;;2;;FB-67-18.1, FB-68-18.2
19;FB/AM;Geografija;H;8;GZ27;Tla Bosne i Hercegovine;Ne;;Da;odgovornost FB-72-19.1;Ne;;;0;;;0;;;0;;;0;;
20;FB/AM;Geografija;H;8;GZ27;Biljni i životinjski svijet Bosne i Hercegovine;Ne;;Da;odgovornost FB-75-20.1, FB-75-20.2;Da;tradicija, pobožnost;ignorancija;0;;;0;;;0;;;0;;
21;FB/AM;Geografija;H;8;GZ27;Stanovništvo, naselja i gospodarstvo Bosne i Hercegovine;Da;pluralizamkaoproblem FB-76-21.1, FB-77-21.4, FB-77-21.5, FB-77-21.6;Da;ratkaozlo FB-77-21.8;Ne;;;0;;;0;;;2;;FB-77-21.4, FB-77-21.5, FB-77-21.6, FB-77-21.7, FB-77-21.9;2;;FB-77-21.3
22;FB/AM;Geografija;H;8;GZ27;Prirodno kretanje i razmještaj stanovništva;Ne;;Ne;;Ne;;;0;;;0;;;2;;FB-80-22.5;2;;FB-79-22.1, FB-79-22.2, FB-79-22.3, FB-80-22.4, FB-82-22.6
23;FB/AM;Geografija;H;8;GZ27;Biološki, gospodarski i obrazovni sastav stanovništva;Da;neodgovornost FB-85-23.1a, FB-85-23.1;Ne;;Ne;;;0;;;0;;;0;;;0;;
24;FB/AM;Geografija;H;8;GZ27;Narodnosni i vjeroispovjedni sastav stanovništva;Da;negativanodnospremaBiH FB-88-24.6;Da;saradnja FB-87-24.4;Da;prošlost ;insinuacija FB-88-24.6;0;;;0;;;2;;FB-87-24.3, FB-87-24.5, FB-89-24.9, FB-89-24.11;2;;FB-87-24.1, FB-87-24.2
25;FB/AM;Geografija;H;8;GZ27;Migracije stanovništva;Ne;;Ne;;Ne;;;1;FB-91-25.1a, FB-91-25.1b;;0;;;2;;FB-90-25.1, FB-91-25.3, FB-92-25.5;2;;FB-91-25.4
26;FB/AM;Geografija;H;8;GZ27;Naselja Bosne i Hercegovine;Ne;;Ne;;Ne;;;1;FB-94-26.1a, FB-95-26.1b, FB-96-21.1c;;0;;;0;;;0;;
27;FB/AM;Geografija;H;8;GZ27;Gospodarstvo Bosne i Hercegovine;Ne;;Ne;;Ne;;;1;FB-99-27.1a, FB-99-27.1b, FB-100-27.1c;;0;;;0;;;0;;
28;FB/AM;Geografija;H;8;GZ27;Poljoprivreda  ;Ne;;Ne;;Ne;;;1;FB-102-28.1a, FB-103-28.1b, FB-104-28.1c;;0;;;0;;;0;;
29;FB/AM;Geografija;H;8;GZ27;Energetika i rudarstvo - osnova industrijskog razvoja i napretka;Ne;;Ne;;Ne;;;0;FB-105-29.1, FB-106-29.2;;0;;;0;;;0;;
30;FB/AM;Geografija;H;8;GZ27;Industrija  ;Ne;;Ne;;Ne;;;1;FB-108-30.1a, FB-109-30.1b, FB-109-30.1c, FB-110-30.1d, FB-110-30.1e;;0;;;0;;;2;;FB-109-30.1
31;FB/AM;Geografija;H;8;GZ27;Trgovina i turizam;Ne;;Ne;;Ne;;;1;FB-111-31.1a, FB-113-31.1b;;0;;;0;;;0;;
32;FB/AM;Geografija;H;8;GZ27;Promet;Ne;;Ne;;Ne;;;1;FB-114-32.1, FB-115-32.2, FB-115-32.3, FB-116-32.4;;0;;;0;;;0;;
33;FB/AM;Geografija;H;8;GZ27;Zemljopisne regije Bosne i Hercegovine - Sjeverna Bosna;Da;rat, neravnopravnost, neprijateljstvo FB-121-33.3, FB-121-33.4;Ne;;Ne;;;1;FB-118-33.1, FB-119-33.1b, FB-120-33.1c, FB-122-33.1e;;0;;;2;;FB-121-33.3, FB-121-33.4;2;;FB-120-33.2, FB-119-33.1
34;FB/AM;Geografija;H;8;GZ27;Srednja Bosna;Da;pluralizamkaoproblem FB-124-34.2, FB-127-34.5;Ne;;Ne;;;1;FB-123-34.6, FB-123-34.7, FB-124-34.8, FB-124-34.9, FB-125-34.10, FB-126-34.11, FB-126-34.12, FB-126-34.13, FB-127-34.14, FB-127-34.14a;;0;;;0;;;0;;
35;FB/AM;Geografija;H;8;GZ27;Regija visokog krša;Ne;;Ne;;Ne;;;1;FB-130-35.2, FB-131-35.3, FB-131-35.4;;0;;;2;;FB-130-35.1;0;;
36;FB/AM;Geografija;H;8;GZ27;Niska Hercegovina;Ne;;Ne;;Ne;;;1;FB-133-36.1, FB-134-36.2, FB-135-36.3, FB-135-36.4, FB-136-36.5;;0;;;0;;;0;;
37;FB/AM;Geografija;H;8;GZ27;Okoliš i njegovo čuvanje;Ne;;Da;zaštitaživotnesredine, odgovornost FB-139-37.1, FB-139-37.2, FB-141-37.3;Ne;;;1;FB-138-37.1a, FB-138-37.1d, FB-139-37.1c, FB-139-37.1b, ;;0;;;0;;;0;;
38;FB/AM;Geografija;H;8;GZ27;Kako čuvati čovjekov okoliš?;Ne;;Da;odgovornost, život FB-142-38.1, FB-143-38.3, FB-143-38.4;Ne;;;0;;;0;;;0;;;2;;FB-142-38.2
39;FB/AM;Geografija;H;8;GZ27;Bosna i Hercegovina i međunarodne integracije;Ne;;Ne;;Ne;;;0;;;0;;;0;;;0;;
1;FB/NH;Geografija;B;8;GZ7;Geografski smješta, položaj i reljef Azije;Ne;;Ne;;Ne;;;1;FB-9-1.1, FB-10-1.2, FB-11-1.3, FB-12-1.4, FB-13-1.5, FB-13-1.6, FB-14-1.7, FB-14-1.9;;1;;;0;; FB-14-1.9;0;;
2;FB/NH;Geografija;B;8;GZ7;Klima, vegetacija i vode Azije;Ne;;Ne;;Ne;;;1;NH-16-2.1a, NH-16-2.1b, NH-17-2.1c, NH-18-2.1d, NH-19-2.1e;;1;;;0;;FB-20-2.1;0;;
3;FB/NH;Geografija;B;8;GZ7;Stanovništvo i privredna obilježja Azije;Ne;;Da;odgovornost, jednakost, multikulturalnost, suživot NH-23-3.2, NH-23-3.3, NH-26-3.7a, NH-25-3.4, NH-26-3.6;Ne;;;1;NH-21-3.1a, NH-21-3.1b, NH-23-3.1c, NH-23-3.1d, NH-25-3.1e;;1;;;0;; FB-26-3.5;0;;
4;FB/NH;Geografija;B;8;GZ7;Srednja Azija - Prirodna i društvena obilježja;Ne;;Ne;;Ne;;;1;NH-27-4.1a, NH-28-4.1b, NH-28-4.1c, NH-30-4.1d, NH-31-4.1e;;1;;;0;;FB-32-4.2;0;;
5;FB/NH;Geografija;B;8;GZ7;Zakavkazje;Ne;;Ne;;Ne;;;1;NH-33-5.1a, NH-34-5.1b, NH-35-5.1c, NH-35-5.1d, NH-37-5.1e;;1;;;0;; FB-37-5.3;0;;
6;FB/NH;Geografija;B;8;GZ7;Srednji istok;Ne;;Ne;;Ne;;;1;NH-38-6.1a, NH-39-6.1b, NH-40-6.1c, NH-41-6.1d;;1;;;0;; FB-41-6.1;0;;
7;FB/NH;Geografija;B;8;GZ7;Monsunska Azija;Ne;;Ne;;Ne;;;1;NH-42-7.1a, NH-42-7.1b, NH-43-7.1c, NH-43-7.1d, NH-43-7.1e, NH-45-7.1f;;1;;;2;;NH-43-7.2, NH-46-7.3, NH-46-7.4;0;;
8;FB/NH;Geografija;B;8;GZ7;Indija - Najveća država južne Azije;Ne;;Ne;;Ne;;;1;NH-48-8.1a, NH-49-8.1b, NH-50-8.1c, NH-50-8.1d, NH-50-8.1e, NH-52-8.1f;;1;;;0;; FB-53-8.1;0;;
9;FB/NH;Geografija;B;8;GZ7;Indonezija i Malezija - Države jugoistoistočne Azije;Ne;;Ne;;Ne;;;1;NH-54-9.1a, NH-55-9.1b, NH-56-9.1c, NH-56-9.1d, NH-57-9.1e, NH-57-9.1f;;1;;;2;;NH-55-9.3;0;;
10;FB/NH;Geografija;B;8;GZ7;Kina - Div istočne Azije;Ne;;Da;odgovornost, saradnja NH-63-10.2, NH-63-10.3;Ne;;;1;NH-61-10.1a, NH-62-10.1b, NH-62-10.1c, NH-63-10.1d;;1;;;0;;;0;;
11;FB/NH;Geografija;B;8;GZ7;Japan - Nippon ili Nihon;Ne;;Da;odgovornost, život;Ne;;;1;NH-68-11.1a, NH-69-11.1b, NH-69-11.1c;;1;;;0;; FB-70-11.1;0;;
12;FB/NH;Geografija;B;8;GZ7;Geografski položaj i prirodno-geografska obilježja Afrike;Ne;;Ne;;Ne;;;1;NH-74-12.2a, NH-75-12.1b, NH-75-12.1c, NH-76-12.1d, NH-77-12.1e, NH-77-12.1f, NH-78-12.1g, NH-78-12.1h;;1;;;0;; FB-79-12.1;0;;
13;FB/NH;Geografija;B;8;GZ7;Stanovništvo i privredna obilježja Afrike;Ne;;Da;solidarnost, odgovornost, humanost, jednakost, pravda, sloboda NH-82-13.4, NH-82-13.5, NH-85-13.7, NH-81-13.3;Ne;;;1;NH-80-13.1a, NH-80-13.1b, NH-82-13.1c;;1;;;0;;;2;;NH-81-13.2, NH-83-13.6
14;FB/NH;Geografija;B;8;GZ7;Nigerija, Kongo, Etiopija i Južnoafrička Republika;Ne;;Da;odgovornost, humanost, solidarnost NH-89-14.2, NH-91-14.3;Ne;;;1;NH-86-14.1a, NH-86-14.1b, NH-87-14.1c, NH-88-14.1d, NH-90-14.1e, NH-91-14.1f, NH-91-14.1g, NH-92-14.1h;;1;;;0;;;0;;
15;FB/NH;Geografija;B;8;GZ7;Geografski položaj, smještaj i podjela Amerike;Ne;;Ne;;Ne;;;1;FB-96-15.1, NH-96-15.1a, NH-97-15.1b, NH-97-15.1c, NH-97-15.1d, NH-98-15.1e, NH-98-15.1f, NH-99-15.1g;;1;;;0;; FB-99-15.2;0;;
16;FB/NH;Geografija;B;8;GZ7;Prirodno-geografska obilježja Amerike (Amerika);Ne;;Ne;;Ne;;;1;FB-100-16.1, NH-100-16.1a, NH-101-16.1b, NH-102-16.1c, NH-103-16.1d, NH-104-16.1e;;1;;;0;; FB-105-16.2;0;;
17;FB/NH;Geografija;B;8;GZ7;Stanovništvo i privredna obilježja Amerike;Ne;;Da;sloboda, jednakost, pravda, ratkaozlo, zaštitaživotnesredine  FB-110-17.6, FB-108-17.3, NH-NH-106-17.1, NH-107-17.2, NH-107-17.3, NH-110-17.7, ;Ne;;;1;NH-108-17.6a, NH-109-17.6b;;1;;;2;;NH-108-17.5, FB-111-17.6a;0;;
18;FB/NH;Geografija;B;8;GZ7;SAD - Svjetska privredna velesila;Ne;;Da;odgovornost, zaštitaživotnesredine FB-115-18.1, FB-117-18.2;Ne;;;1;FB-112-18.1a, FB-113-18.1b, FB-115-18.1c, FB-115-18.1d, FB-117-18.1e, FB-118-18.1f;;1;;;0;; FB-118-18.3;0;;
19;FB/NH;Geografija;B;8;GZ7;Kanada ili Canata;Ne;;Ne;;Ne;;;1;FB-119-19.1a, FB-119-19.1b, FB-119-19.1c, FB-121-19.1d, FB-122-19.1e, FB-123-19.1f;;1;;;0;; FB-124-19.2;0;;
20;FB/NH;Geografija;B;8;GZ7;Brazil, Argentina i Čile;Ne;;Ne;;Ne;;;1;FB-125-20.1a, FB-125-20.1b, FB-126-20.1c, FB-126-20.1d, FB-127-20.1e, FB-128-20.1f, FB-128-20.1g, FB-129-20.1h, FB-130-20.1i, FB-131-20.1k, FB-131-20.1l;;1;;;0;; FB-131-20.3;0;;
21;FB/NH;Geografija;B;8;GZ7;Australija - Kontinent na drugom kraju svijeta;Ne;;Da;zaštitaživotnesredine, pravda NH-134-21.2, NH-135-21.3, NH-142-21.5, NH-138-21.4;Ne;;;1;NH-134-21.1a, NH-135-21.1b, NH-136-21.1c, NH-138-21.1d, NH-140-21.1e, FB-134-21.1;;1;;;0;; FB-142-21.7;0;;
22;FB/NH;Geografija;B;8;GZ7;Okeanija (Oceanija) - Brojni otoci u Tihom okeanu;Ne;;Da;zaštitaživotnesredine, odgovornost FB-146-22.1, FB-146-22.2, NH-147-22.5, NH-148-22.6;Ne;;;1;NH-143-22.1a, NH-146-22.1b;;1;;;0;; FB-148-22.4;0;;
23;FB/NH;Geografija;B;8;GZ7;Polarna područja;Ne;;Ne;;Ne;;;1;NH-150-23.1a, NH-152-23.1b, NH-152-23.1c, NH-153-23.1d;;1;;;0;; FB-155-23.4;0;;
1;FB/NH;Geografija;S;8;GZ13;Azija - Opšti geografski podaci o kontinentu;Ne;;Ne;;Ne;;;1;FB-10-1.1, FB-11-1.2, FB-11-1.3, FB-11-1.4;;1;;;0;;;0;;
2;FB/NH;Geografija;S;8;GZ13;Reljef i klima Azije;Ne;;Ne;;Ne;;;1;FB-13-2.1, FB-15-2.2;;1;;;0;;;0;;
3;FB/NH;Geografija;S;8;GZ13;Hidrografske i biogeografske osobine Azije;Ne;;Ne;;Ne;;;0;;;0;;;0;;;0;;
4;FB/NH;Geografija;S;8;GZ13;Stanovništvo, politička i regionalna podjela;Da;sukob FB-22-4.2;Da;odgovornost FB-21-4.1;Ne;;;0;;;0;;;2;;FB-22-4.2, NH-22-4.4;2;;NH-21-4.1
5;FB/NH;Geografija;S;8;GZ13;Prirodnogeografske osobine jugozapadne Azije;Da;sukob NH-26-5.3;Ne;;Ne;;;0;;;0;;;0;;;2;;NH-26-5.3
6;FB/NH;Geografija;S;8;GZ13;Stanovništvo, privreda i politička podjela;Da;sukob FB-29-6.5, FB-29-6.6, FB-30-6.7;Ne;;Ne;;;0;;;0;;;2;;NH-31-6.8;2;;NH-28-6.1
7;FB/NH;Geografija;S;8;GZ13;Geografski položaj i prirodne karakteristike južne Azije;Ne;;Ne;;Ne;;;1;FB-34-7.1, FB-35-7.2, FB-36-7.3;;1;NH-35-7.1a, NH-36-7.1b;;0;;;0;;
8;FB/NH;Geografija;S;8;GZ13;Stanovništvo, privredne karakteristike i politička podjela južne Azije;Ne;;Ne;;Ne;;;0;;;0;;;0;;;0;;
9;FB/NH;Geografija;S;8;GZ13;Specifičnosti geografskog položaja i prirodne sredine;Ne;;Ne;;Ne;;;1;NH-40-9.1a, NH-42-9.1b;;1;FB-40-9.1, FB-41-9.2, FB-42-9.3;;0;;;0;;
10;FB/NH;Geografija;S;8;GZ13;Stanovništvo, privreda i politička podjela jugoistočne Azije;Ne;;Ne;;Ne;;;1;NH-43-10.1a, NH-46-10.1b;;1;FB-43-10.1a, FB-46-10.1b;;0;;;0;;
11;FB/NH;Geografija;S;8;GZ13;Geografski pregled istočne Azije;Ne;;Ne;;Ne;;;1;NH-48-11.1a, NH-49-11.1b, NH-50-11.1c, NH-50-11.1d;;1;NH-48-11.1a, NH-49-11.1b, NH-50-11.1c, NH-50-11.1d;;0;;;0;;
12;FB/NH;Geografija;S;8;GZ13;NR Kina - geografski položaj, podjela, demografska obilježja, društveno i državno uređenje;Ne;;Da;odgovornost FB-54-12.1;Ne;;;1;NH-51-12.1a;;1;NH-51-12.1a;;0;;;0;;
13;FB/NH;Geografija;S;8;GZ13;Privredne odlike Kine;Ne;;Da;život, saradnja FB-58-13.1;Ne;;;0;;;0;NH-57-13.1a;;0;;;2;;NH-58-13.2
14;FB/NH;Geografija;S;8;GZ13;Japan - osnovna obilježja prirodne sredine;Ne;;Ne;;Ne;;;1;NH-61-14.1a, NH-61-14.1b, NH-63-14.1c;;1;NH-61-14.1a, NH-61-14.1b, NH-63-14.1c;;0;;;0;;
15;FB/NH;Geografija;S;8;GZ13;Geografske osobine srednje Azije;Ne;;Ne;;Ne;;;1;NH-66-15.1a, NH-68-15.1b;;1;NH-66-15.1a, NH-68-15.1b;;0;;;0;;
16;FB/NH;Geografija;S;8;GZ13;Afrika - osnovni geografski podaci o kontinentu;Ne;;Ne;;Ne;;;1;NH-72-16.1a, NH-74-16.1b, NH-74-16.1c;;1;NH-72-16.1a, NH-74-16.1b, NH-74-16.1c;;0;;;0;;
17;FB/NH;Geografija;S;8;GZ13;Osnovna obilježja prirodne sredine;Ne;;Ne;;Ne ;;;1;NH-76-17.1a, NH-79-17.1b, NH-79-17.1c;;1;NH-76-17.1a, NH-79-17.1b, NH-79-17.1c;;0;;;0;;
18;FB/NH;Geografija;S;8;GZ13;Stanovništvo, kolonijalizam, dekolonizacija i regionalna podjela Afrike;Ne;;Ne;;Ne;;;0;;;0;;;0;;;2;;NH-81-18.1a, NH-81-18.1b
19;FB/NH;Geografija;S;8;GZ13;Geografski položaj i prirodne osobine sjeverne Afrike;Ne;;Ne;;Ne;;;1;NH-86-19.1a, NH-87-19.1b, NH-88-19.1c, NH-89-19.1c;;1;NH-86-19.1a, NH-87-19.1b, NH-88-19.1c, NH-89-19.1c;;0;;;0;;
20;FB/NH;Geografija;S;8;GZ13;Društveno-geografske karakteristike i politička podjela;Ne;;Ne;;Ne;;;1;NH-90-20.1a, NH-91-20.1b, NH-92-20.1c, NH-91-20.1d;;1;NH-90-20.1a, NH-91-20.1b, NH-92-20.1c, NH-91-20.1d;;2;;NH-90-20.2;0;;
21;FB/NH;Geografija;S;8;GZ13;Geografski položaj i prirodna obilježja istočne Afrike;Ne;;Ne;;Ne;;;1;NH-95-21.1a, NH-95-21.1b, NH-96-21.1c, FB-97-21.4;;1;FB-95-21.1, FB-95-21.2, FB-96-21.3, FB-97-21.4;;0;;;0;;
22;FB/NH;Geografija;S;8;GZ13;Stanovništvo, privredne karakteristike i politička podjela  ;Ne;;Ne;;Ne;;;1;NH-100-22.1a, NH-100-22.b;;1;NH-100-22.1a, NH-100-22.b;;0;;;0;;
23;FB/NH;Geografija;S;8;GZ13;Gvinejske zemlje - opšte geografske osobine;Ne;;Ne;;Ne;;;1;NH-102-23.1a, NH-102-23.1b, NH-103-23.1c, NH-103-23.1d, NH-104-23.1e, NH-106-23.1f;;1;NH-102-23.1a, NH-102-23.1b, NH-103-23.1c, NH-103-23.1d, NH-104-23.1e, NH-106-23.1f;;0;;;0;;
24;FB/NH;Geografija;S;8;GZ13;Centralna Afrika - opšte geografske odlike;Ne;;Ne;;Ne;;;1;NH-108-24.1a, NH-108-24.1b, NH-109-24.1c ;;1;NH-108-24.1a, NH-108-24.1b, NH-109-24.1c;;0;;;0;;
25;FB/NH;Geografija;S;8;GZ13;Južna Afrika - opšte geografske odlike;Ne;;Da;ravnopravnost FB-114-25.1;Ne;;;1;NH-112-25.1a, NH-112-25.1b, NH-113-25.1c, NH-113-25.1d;;1;NH-112-25.1a, NH-112-25.1b, NH-113-25.1c, NH-113-25.1d;;0;;;0;;
26;FB/NH;Geografija;S;8;GZ13;Amerika - opšti geografski pregled;Ne;;Ne;;Ne;;;1;NH-118-26.1a, NH-119-26.1b;;1;NH-118-26.1a, NH-119-26.1b;;0;;;0;;
27;FB/NH;Geografija;S;8;GZ13;Raznolikost prirodnogeografskih faktora;Ne;;Ne;;Ne;;;1;NH-125-27.1a, NH-126-27.1b, NH-126-27.1c, NH-127-27.1d, NH-128-27.1e, NH-129-27.1e;;1;NH-125-27.1a, NH-126-27.1b, NH-126-27.1c, NH-127-27.1d, NH-128-27.1e, NH-129-27.1e;;0;;;0;;
28;FB/NH;Geografija;S;8;GZ13;SAD - prirodna i demografska obilježja;Ne;;Da;jednakost, ravnopravnost, život FB-134-28.1, FB-135-28.2, FB-135-28.3;Ne;;;1;NH-132-28.1a, NH-133-28.1b, NH-135-28.1c;;1;NH-132-28.1a, NH-133-28.1b, NH-135-28.1c;;0;;;0;;
29;FB/NH;Geografija;S;8;GZ13;Razvoj i privredne karakteristike SAD;Ne;;Ne;;Ne;;;1;NH-136-29.1a, NH-137-29.1b, NH-138-29.1c;;1;NH-136-29.1a, NH-137-29.1b, NH-138-29.1c;;0;;;0;;
30;FB/NH;Geografija;S;8;GZ13;Kanada - zemlja širokih prostranstava, rijetke naseljenosti i velikih privrednih mogućnosti;Ne;;Da;odgovornost, zaštitaživotnesredine FB-144-30.2;Ne;;;1;NH-141-30.1a, NH-143-30.1b;;1;NH-141-30.1a, NH-143-30.1b;;0;;;0;;
31;FB/NH;Geografija;S;8;GZ13;Geografski pregled srednje Amerike;Ne;;Ne;;Ne;;;0;;;0;;;0;;;0;;
32;FB/NH;Geografija;S;8;GZ13;Meksiko - zemlja konstrasta;Ne;;Ne;;Ne;;;1;NH-150-32.1a, NH-150-32.1b, NH-152-32.1c;;1;NH-150-32.1a, NH-150-32.1b, NH-152-32.1c;;0;;;0;;
33;FB/NH;Geografija;S;8;GZ13;Prirodna osnova, stanovništvo, privredne karakteristike i politička podjela;Ne;;Ne;;Ne;;;1;NH-155-33.1a, NH-157-33.1b, NH-158-33.1c;;1;NH-155-33.1a, NH-157-33.1b, NH-158-33.1c;;0;;;0;;
34;FB/NH;Geografija;S;8;GZ13;Brazil - zemlja velikog privrednog uspona;Ne;;Ne;;Ne;;;1;NH-163-34.1a, NH-163-34.1b;;1;NH-163-34.1a, NH-163-34.1b;;0;;;0;;
35;FB/NH;Geografija;S;8;GZ13;Argentina - kontrast prirodnih oblasti;Ne;;Ne;;Ne;;;1;NH-165-35.1a, NH-166-35.1b, NH-166-35.1c, FB-165-35.1;;1;NH-165-35.1a, NH-166-35.1b, NH-166-35.1c, FB-165-35.1;;0;;;0;;
36;FB/NH;Geografija;S;8;GZ13;Australije - otkriće i osnovne prirodno-geografske osobine;Ne;;Da;jednakost, život, zaštitaživotnesredine FB-175-36.1, FB-177-36.2, FB-177-36.3;Ne;;;1;NH-170-36.1a, NH-170-36.1b, NH-172-36.1c, NH-174-36.1d;;1;NH-170-36.1a, NH-170-36.1b, NH-172-36.1c, NH-174-36.1d;;2;;NH-175-36.3;0;;
37;FB/NH;Geografija;S;8;GZ13;Novi Zeland - osnovne prirodne i društvene osobine;Ne;;Da;jednakost FB-180-37.1;Ne;;;0;;;0;;;0;;;0;;
38;FB/NH;Geografija;S;8;GZ13;Okeanija - položaj, klima i stanovništvo;Ne;;Ne;;Ne;;;0;;;0;;;0;;;0;;
39;FB/NH;Geografija;S;8;GZ13;Arktik - oblasti surove klime;Ne;;Ne;;Ne;;;0;;;0;;;0;;;0;;
40;FB/NH;Geografija;S;8;GZ13;Antarktik;Ne;;Da;odgovornost, zaštitaživotnesredine, život NH-190-40.1, NH-190-40.2, NH-143-40.3;Ne;;;0;;;0;;;0;;;0;;
