Rb;Istraživači;Predmet;NPP;Razred;Udžbenik;Lekcija;Negativni oblici ponašanja;Navedite šta;Univerzalne vrijednosti;Navedite šta;Partikularizacija vrijednosti;Sadržaji;Načini;Indikator 1;Aktivno učenje;Ne nudi se mogućnost diskusije;Indikator 2;Rješavanje problema;Puko pamćenje činjenica;Indikator 3;Mutiperspektivni pristup;Pristup jedne perspektive;Indikator 4 ;Diferencirani prikazi;Stereotipni prikazi
1;NI/ZS;Vjeronauka;B;6;V10;Uvod;Ne;;Da;solidarnost, odgovornost ZS-5;Ne;;;0;;;0;;;0;;;0;;
2;NI/ZS;Vjeronauka;B;6;V10;Moje potrebe i težnje - Novi početak;Ne;;Da;sloboda, odgovornost NI-6-1, ZS-6;Da;pobožnost NI-6-2;redukcija;1;ZS-7-a, ZS-7-b ;;1;NI-7-2, NI-7-4, ZS-7-a, ZS-7-b ;NI-7-1;0;;;0;;
3;NI/ZS;Vjeronauka;B;6;V10;Svijetu se ne može ugoditi (Tjelesne i duševne potrebe);Ne;;Da;odgovornost NI-8-2, NI-9-1;Da;pobožnost NI-8-1, NI-9-2;redukcija;1;ZS-8-a, NI-8-4;;1;ZS-9-a;;0;;;0;;
4;NI/ZS;Vjeronauka;B;6;V10;Uči, čitaj! Voće života;Ne;;Da;život NI-11-1, odgovornost NI-12-2;Da;pobožnost NI-12-3;redukcija;2;;ZS-11, ZS-12-a, NI-14;2;ZS-13, ZS-14-b, NI-11-3;ZS-12-b, NI-11-2, NI-12-1, NI-12-4;0;;;2;;NI-10
5;NI/ZS;Vjeronauka;B;6;V10;Pišem i čitam arebicu - Tajna iz nanine sehare;Ne;;Ne;;Ne;;;2;ZS-17-c;ZS-17-a;2;;NI-17-1, NI-17-2, NI-17-3;2;;NI-15-2;2;;NI-16
6;NI/ZS;Vjeronauka;B;6;V10;Drugi i ja zajedno - Nagluhi čovjek;Da;neravnopravnost ZS-20-a;Da;mir NI-20-3, jednakost, solidarnost, saradnja ZS-20-b, odgovornost ZS-21-a;Ne;;;1;ZS-21-b, ZS-21-c, NI-21-1;;1;ZS-21-a, NI-20-2, NI-21-2;NI-20-1;0;;;0;;
7;NI/ZS;Vjeronauka;B;6;V10;Poštivanje i dobri odnosi - Okrutni lav i pametni zec;Ne;;Da;mir, jednakost ZS-22, ZS-23-c ZS-23-e, ZS-23-d, ZS-23-f, sloboda, saradnja ZS-24, NI-22, NI-23-4, NI-23-5, NI-23-6;Da;pobožnost ZS-23, NI-23-1;redukcija ZS-23-a, imputacija;1;NI-23-3, NI-25-2;ZS-25-a;2;ZS-25-b, ZS-25-c;NI-23-2, NI-25-1;0;;;1;ZS-24;
8;NI/ZS;Vjeronauka;B;6;V10;Čuje li onaj što se poziva - Trgovac i papagaj (Izgradnja pozitivnih osobina);Ne;;Da;solidarnost ZS-27-b, ZS-27-c, odgovornost NI-27-5;Da;pobožnost NI-27-6;redukcija;1;ZS-27-a, NI-29-2;;1;ZS-29-b, ZS-27-c, NI-27-2, NI-27-3 ;NI-27-1, NI-29-1;2;;NI-27-7, NI-27-4;2;ZS-28;NI-26-1, NI-28
9;NI/ZS;Vjeronauka;B;6;V10;Ljut sam, jako sam ljut (Kontrola ljutnje);Ne;;Da;odgovornost NI-30-3, saradnja NI-31-2;Da;pobožnost NI-31-2;redukcija;1;ZS-31-a, NI-32-2;;1;ZS-32-a, ZS-32-b, NI-32-1;;2;;NI-30-2;0;;
10;NI/ZS;Vjeronauka;B;6;V10;Rješavanje sukoba - Mačke i majmun;Ne;;Da;odgovornost ZS-34-a, NI-34, saradnja NI-36-1 ;Ne;;;1;ZS-35-c, ZS-36-a, NI-33-2, NI-33-4;;1;ZS-35-a, ZS-35-b, NI 33-3, NI-35-2;NI-33-1;0;;;0;;
11;NI/ZS;Vjeronauka;B;6;V10;Na nepravdu pravdom odgovori - Ne čini nasilje;Ne;;Da;jednakost, pravda ZS-37, mir ZS-38-a, NI-38-1, NI-38-2;Ne;;;1;ZS-39-a, ZS-39-b, ZS-39-d, NI-37-2, NI-37-3, NI-39-2;;1;ZS-39-c, NI-39-1;NI-37-1;0;;;1;ZS-38-b;
12;NI/ZS;Vjeronauka;B;6;V10;Osmijeh i ljubaznost su sadaka - Zaviri u moju dušu;Da;korupcija NI-41;Da;solidarnost NI-40-1 ;Da;pobožnost NI-40-2;redukcija ;1;ZS-43-b, ZS-43-d;;2;NI-43;ZS-42, ZS-43-a, NI-41-1;2;;NI-41-2;2;;ZS-42, ZS-41-a, NI-42
13;NI/ZS;Vjeronauka;B;6;V10;Težnja za srećom - Komadići sreće Car i košulja;Ne;;Da;solidarnost ZS-45-b, život;Ne;;;1;ZS-44, ZS-45-a, ZS-46-b, NI-44-1, NI-44-3, NI-45-2;NI-46-2;2;ZS-47;NI-44-2, NI-45-1, NI-45-3;0;;;2;;ZS-46-a
14;NI/ZS;Vjeronauka;B;6;V10;Strpljivost kao vrlina - Allah iskušava one koje voli;Ne;;Da;solidarnost ZS-48, odgovornost NI-50-9;Da;pobožnost NI-50-1, NI-50-4;;2;ZS-49-a;NI-50-7;2;NI-49-3, NI-50-6, NI-50-7;ZS-50, NI-49-1, NI-50-2, NI-50-5;2;;NI-50-3, NI-50-4;0;;
15;NI/ZS;Vjeronauka;B;6;V10;Moć praštanja - Kazivanje o onom koji je praštati znao Sura El-Asr;Ne;;Ne;;Ne;;;1;ZS-55-a, NI-54-3, NI-55-2;;2;NI-56-1, NI-56-2;ZS-54-a, ZS-56-a, NI-54-1, NI-54-2, NI-55-1;0;;;0;;
16;NI/ZS;Vjeronauka;B;6;V10;Izvršimo preuzete obaveze - Obećanje je dug Muhamedov emanet;Ne;;Da;odgovornost ZS-59, NI-58-3, NI-59;Da;pobožnost NI-58-4;;2;NI-64-4;ZS-61-b;2;NI-61-2, NI-61-4;ZS-58, ZS-61-a, NI-58-1, NI-58-2, NI-61-1, NI-61-3;0;;;0;;
17;NI/ZS;Vjeronauka;B;6;V10;Istraj i kad ti je teško - Allahova milost je neizmjerna;Ne;;Da;odgovornost NI-64-1;Ne;;;1;ZS-65-a, ZS-65-b, ZS-65-c, NI-64-2;ZS-64-a;1;ZS-64-b, NI 64-3, NI-65;NI-63;2;;;0;;
18;NI/ZS;Vjeronauka;B;6;V10;Fatima Ez-Zehra omiljena kćerka;Ne;;Ne;;Ne;;;2;;NI-67-4;2;;NI-66-1, NI-66-2, NI-67-2, NI-67-3, NI-67-5;2;;NI-67-1;0;;
19;NI/ZS;Vjeronauka;B;6;V10;Moji roditelji, moji uzori;Ne;;Ne;;Ne;;;2;ZS-70-a, NI-69-3;ZS-69-a, ZS-69-b, NI-69-5;2;NI-69-2;ZS-69-c, ZS-70-b, NI-69-1;0;;;2;;ZS-69-d, NI-69-4
20;NI/ZS;Vjeronauka;B;6;V10;Iz života Poslanika, a.s. Događaj koji je prethodio Hidžri;Ne;;Ne;;Ne;;;2;NI-73-4;ZS-73-a, ZS-73-b, NI-73-6;2;;ZS-73-c, NI-73-1, NI-73-2, NI-73-3;2;;NI-73-5;0;;
21;NI/ZS;Vjeronauka;B;6;V10;Hidžra - put ka uspjehu - Tale a-l-Bedru alejna;Ne;;Da;mir ZS-77-b, odgovornost NI-76-3;Da;pobožnost NI-77-1;redukcija;1;ZS-76-a;NI-77-3;2;;ZS-76-b, ZS-77-a, NI-76-1, NI-76-2, NI-77-2;2;;NI-75;0;;
22;NI/ZS;Vjeronauka;B;6;V10;Međusobno pomaganje muslimana;Ne;;Da;saradnja ZS-78, solidarnost ZS-79-a, NI-78-1, jednakost NI-78-2, odgovornost NI-78-3 ;Da;pobožnost NI-79-3;redukcija ;2;NI-80-3;NI-80-2;2;NI-79-2;ZS-80, NI-78-4, NI-78-5, NI-79-1, NI-80-1;0;;;0;;
23;NI/ZS;Vjeronauka;B;6;V10;Snaga zajedništva - Izgradnja Poslanikove džamije;Ne;;Ne;;Ne;;;1;ZS-83-c;;2;;ZS-82, ZS-83-b, NI-82-1, NI-82-2, NI-82-3, NI-83-1, NI-83-2;0;;;0;;
24;NI/ZS;Vjeronauka;B;6;V10;Poslanikova džamija nekad i sad;Ne;;Ne;;Ne;;;2;;NI-85-4, NI-86-4;2;;ZS-86, ZS-87;2;;NI-85;0;;
25;NI/ZS;Vjeronauka;B;6;V10;Vjerom do prosvijetljenosti i oplmenjenosti - Sura El-kafirun;Da;neravnopravnost NI-88-3;Da;sloboda ZS-88, NI-88-5, NI-89-3;Da;pobožnost NI-88-6;redukcija ZS-88, ZS-89-c;2;;ZS-89-a, NI-88-1, NI-89-1, NI-89-2, NI-89-4;1;ZS-89-b;;2;;NI-88-2, NI-88-4;2;;
26;NI/ZS;Vjeronauka;B;6;V10;Razvoj vjerovanja;Ne;;Ne;;Ne;;;2;;ZS-91-b, ZS-91-c, NI-90-1, NI-91-2;2;ZS-91-d;NI-90-3, NI-91-1, NI-91-3;2;;ZS-91-a, NI-90-2;0;;
27;NI/ZS;Vjeronauka;B;6;V10;Osobe koje poštujem;Ne;;Da;saradnja, jednakost ZS-92, ZS-93a, odgovornost NI-93-1;Ne;;;2;NI-93-6;ZS-93-c, NI-93-2;2;NI-93-5;ZS-93-b, NI-93-3, NI-93-4;2;;NI-92-1, NI-92-2;0;;
28;NI/ZS;Vjeronauka;B;6;V10;Stvoritelj nam se otkriva u svojim djelima;Ne;;Ne;;Ne;;;2;NI-95-3, NI-95-4;ZS-95;2;;ZS-96, NI-95-1, NI-95-2;0;;;0;;
29;NI/ZS;Vjeronauka;B;6;V10;Milost Božija;Ne;;Da;odgovornost NI-98-4;Da;pobožnost NI-98-1;mistifikacija;2;;NI-98-2, NI-98-3;2;;ZS-98, NI-98-1;0;;;0;;
30;NI/ZS;Vjeronauka;B;6;V10;Posljedice mojih djela - Sura El-Maun;Ne;;Da;odgovornost ZS-99, NI-99-2;Ne;;;2;NI-100-2;ZS-100, NI-101-1, NI-101-2 ;2;;NI-100-1;0;;;0;;
31;NI/ZS;Vjeronauka;B;6;V10;Pravednost Božija;Ne;;Da;jednakost ZS-102, NI-103-4;Da;pobožnost NI-103-3, NI-103-5;mistifikacija ZS-102, redukcija;2;ZS-103-b, NI-103-4;ZS-103-a, NI-103-2;1; ZS-103-c, NI-103-7 ;NI-103-1;0;;;0;;
32;NI/ZS;Vjeronauka;B;6;V10;Različiti oblici molitve;Da;neravnopravnost NI-104;Ne;;Ne;;;2;NI-105-3;ZS-106-c, ZS-106-e, NI-105-5, NI-106-3;2;;ZS-106-d, NI-105-1, NI-105-2, NI-105-4, NI-106-1, NI-106-2;1;;ZS-104, ZS-105-b;1;;ZS-105-a
33;NI/ZS;Vjeronauka;B;6;V10;Prilike u kojima se obraćam Bogu;Da;neravnopravnost NI-109-1;Ne;;Ne;;;2;;ZS-109, NI-109-2;2;;ZS-108, NI-108-1, NI-108-2, NI-109-4;2;;NI-108-3;2;;NI-108-4, NI-109-3
34;NI/ZS;Vjeronauka;B;6;V10;Allah kojeg moje srce voli - Namaz - doživljaj izuzetne vrijednosti;Ne;;Ne;;Ne;;;2;;ZS-110, NI-111-2, NI-111-3;2;;ZS-112, NI-110, NI-111-1, NI-112-1;2;;NI-112-2;0;;
35;NI/ZS;Vjeronauka;B;6;V10;Mjesta hvaljenja i slavljenja Stvoritelja;Ne;;Ne;;Ne;;;0;;;2;;ZS-115, ZS-116a, NI-115;0;;;0;;
36;NI/ZS;Vjeronauka;B;6;V10;Mjesta za molitvu u prirodi - Mjesta za molitvu drugih;Ne;;Da;saradnja ZS-117-a, sloboda, odgovornost NI-117-1;Da;pobožnost NI-117-5;redukcija;2;;NI-117-3;2;NI-118-3;ZS-117-b, ZS-118-a, NI-117-2, NI-118-1, NI-118-2;0;;;0;;
37;NI/ZS;Vjeronauka;B;6;V10;Kad sunce dostigne svoj vrhunac - Podne namaz;Ne;;Ne;;Ne;;;2;;ZS-121;2;;NI-119-1, NI-119-2;0;;;0;;
38;NI/ZS;Vjeronauka;B;6;V10;Putnik sebi konak traži (ilahija);Ne;;Ne;;Ne;;;0;;;2;;ZS-122, NI-122;0;;;0;;
39;NI/ZS;Vjeronauka;B;6;V10;Kako je nastao hidžretski kalendar;Ne;;Ne;;Ne;;;2;;NI-123-1, NI-124-2;2;;ZS-123, ZS-124, NI-123-1, NI-124-1;0;;;0;;
40;NI/ZS;Vjeronauka;B;6;V10;Ramazanska večer;Ne;;Ne;;Ne;;;2;;ZS-125;2;;NI-125;0;;;0;;
1;ZS/ZMP;Pravoslavna vjeronauka;S;9;V9;"O čovjeku kao jedinom moralnom biću na zemlji; Čovjek je najuzvišenije biće na zemlji";Da;nejednakost ZPM-6-a, ZPM-6-c;Da;odgovornost ZPM-5-b, ZPM-5-c;Da;pobožnost;redukcija, mistifikacija;2;;ZS-5-a, ZPM-5;2;;ZS-7-a, ZPM-5;2;;ZS-6, ZPM-5;0;;
2;ZS/ZMP;Pravoslavna vjeronauka;S;9;V9;"O moralnom zakonu; Pisani ili natprirodni moralni zakon";Da;nejednakost ZPM-8-a;Da;odgovornost ZS-9-a, ZPM-8-c, ZPM-9-a, ZPM-9-b, ZPM-9-c, ZPM-10-a, jednakost ZPM-8-d;Da;pobožnost;redukcija, mistifikacija;2;;;2;;ZS-9-a;2;;ZS-9-c;0;;
3;ZS/ZMP;Pravoslavna vjeronauka;S;9;V9;"Starozavjetni I novozavjetni moralni zakon; Dvije Hristove zapovijesti o ljubavi";Ne;;Da;solidarnost ZPM-11-d, odgovornost ZPM-12-a;Da;pobožnost;redukcija, mistifikacija;2;;ZS-13-a;2;;ZS-13-c;2;;ZS-13-b;0;;
4;ZS/ZMP;Pravoslavna vjeronauka;S;9;V9;"Narušavanje moralnog zakona; Vrste grijeha; lakši I teški smrtni grijesi";Da;osvetoljubivost ZS-15-b;Ne;;Ne;;;2;;ZS-14;2;;ZS-18 ;2;ZPM-16-h;;0;;
5;ZS/ZMP;Pravoslavna vjeronauka;S;9;V9;Pokajanje I borba protiv grijah;Ne;;Da;odgovornost ZPM-19-a, solidarnost ZPM-20-b;Da;pobožnost;redukcija, mistifikacija;2;;ZS-21-a;2;;ZS-21-b ;2;;ZS-20-a;0;;
6;ZS/ZMP;Pravoslavna vjeronauka;S;9;V9;"O savjesti I slobodi volje; O savjest; O slobodi volje";Ne;;Da;odgovornost ZS-23-b, ZPM-22-a, ZPM-22-a, ZPM-22-b, ZPM-22-c, ZPM-22-d, ZPM-23-c, ZPM-23-d, život ZPM-22-a, ZPM-22-b, ZPM-22-c, ZPM-22-d;Da;pobožnost ZS-23-b;redukcija, mistifikacija;0;;ZPM-22;2;;ZS-23-c, ZPM-22-a, ZPM-22-b, ZPM-22-c, ZPM-23-a, ZPM-23-b;0;;;0;;
7;ZS/ZMP;Pravoslavna vjeronauka;S;9;V9;O hršćanskim dužnostima;Ne;;Da;odgovornost ZS-24, ZS-25-a, ZPM-24-d;Da;pobožnost ZS-24, ZS-25-a;redukcija, mistifikacija;2;;ZPM-24-a, ZPM-24-b, ZPM-24-c;2;;ZS-25-b;0;;;0;;
8;ZS/ZMP;Pravoslavna vjeronauka;S;9;V9;Hrišćanske vrline: vjera, nada i ljubav;Da;neprijateljstvo ZS-26-a, ZS-27-c, pluralizamkaoproblem ZPM-26-b, ZPM-26-c, ZPM-26-d;Da;odgovornost  ZPM-26-a, solidarnost ZPM-27-a, ZPM-27-b, ZPM-27-c, ZPM-27-d;Da;pobožnost;redukcija, mistifikacija, insinuacija;2;ZPM-27-e;ZPM-26-a, ZPM-26-b, ZPM-26-c, ZPM-26-d, ZPM-27-a, ZPM-27-b;2;;ZS-27-b;2;;ZPM-26-a, ZPM-26-b, ZPM-26-c, ZPM-26-d;2;;ZS-26-a
9;ZS/ZMP;Pravoslavna vjeronauka;S;9;V9;Hiršćanske vrline;Ne;;Da;solidarnost ZS-28, ZS-29, ZS-30-a, ZPM-29-b, ZPM-29-c, ZPM-29-d, život ZPM-28-a, ZPM-29-a, ZPM-30-a, odgovornost ZPM-28-a, ZPM-28-c, ZPM-29-a, saradnja ZPM-30-a, ZPM-30-b, ZPM-30-c;Da;pobožnost ZS-30-a;redukcija;2;;ZPM-28-a, ZPM-28-b, ZPM-28-c;2;;ZS-30-b, ZPM-28-a, ZPM-28-b, ZPM-28-c;2;;ZPM-28-a, ZPM-28-b, ZPM-28-c;0;;
10;ZS/ZMP;Pravoslavna vjeronauka;S;9;V9;Grijesi protiv hrišćanskih vrlina;Ne;;Da;jednakost ZPM-31-b;Da;pobožnost;redukcija;2;;ZPM-28-a, ZPM-28-b, ZPM-28-c;2;;ZS-33;2;;;2;;ZS-32-a
11;ZS/ZMP;Pravoslavna vjeronauka;S;9;V9;O postu;Ne;;Ne;;Ne;;;2;;ZPM-34-a, ZPM-34-b;2;;ZS-35;2;;;0;;
12;ZS/ZMP;Pravoslavna vjeronauka;S;9;V9;O zavjetu I zakletvi - Zavjeti, Zakletva;Ne;;Da;saradnja ZPM-36-a;Da;pobožnost;redukcija;2;;;2;;ZS-37;0;;;0;;
13;ZS/ZMP;Pravoslavna vjeronauka;S;9;V9;Stupnjevi duhovnog usavršavanja htišćana prema Hristovoj besjedi na gori;Ne;;Da;život ZPM-38-a, ZPM-39-a, mir ZPM-39-b;Da;pobožnost;redukcija;2;;ZS-38;2;;ZS-40;2;;;0;;
14;ZS/ZMP;Pravoslavna vjeronauka;S;9;V9;O smirenosti I pokajanju u vezi sa prvim I drugim blaženstvom;Ne;;Ne;;Ne;;;2;;ZPM-41, ZPM-42;2;;ZS-42;0;;;0;;
15;ZS/ZMP;Pravoslavna vjeronauka;S;9;V9;O krotosti I pravdi - Treće I četvrto blaženstvo;Ne;;Da;mir ZPM-43-a, jednakost, odgovornost ZPM-44-b;Da;pobožnost;redukcija;2;;ZS-43, ZS-44a;2;;ZS-44-b;2;;ZPM-43, ZPM-44;0;;
16;ZS/ZMP;Pravoslavna vjeronauka;S;9;V9;O milosrđu, čistoti srca I mirotvorstvu;Da;pluralizamkaoproblem ZPM-46-b;Da;solidarnost ZS-45, ZPM-45-a, mir ZS-46-a, ZPM-45-c, ZPM-46-a, ZPM-46-b, jednakost ZPM-45-b, odgovornost ZPM-45-g, ZPM-45-d, ZPM-46-c, život ZPM-46-a;Da;pobožnost, ZS-45, ZS-46-a, ZPM-45-b, ZPM-45-g, ZPM-45-d, ZPM-46-a,ZPM-46-b, ZPM-46-c, patrijarhat ZPM-46-d;imputacija ZS-45, ZS-46-a, redukcija, mistifikacija;2;;;2;;ZS-46-b;0;;;2;;ZPM-46-b
17;ZS/ZMP;Pravoslavna vjeronauka;S;9;V9;O stradnju - Osmo I deveto blaženstvo - Stradanje za pravdu/vjeru;Ne;;Da;odgovornost ZPM-47-a, ZPM-47-b;Da;pobožnost;redukcija, mistifikacija;2;;ZPM-47-a, ZPM-47-b;2;;ZS-47-b;0;;;2;;ZPM-47-a, ZS-47-a
18;ZS/ZMP;Pravoslavna vjeronauka;S;9;V9;Hrišćanstvo I zajednica - Brak, dužnosti djece i roditelja jednih prema drugima;Da;neravnopravnost ZPM-50-b;Da;život ZPM-48-a, odgovornost ZPM-48-a, ZPM-50-a, ZPM-50-b, ZPM-50-c, ZPM-51-a, ZPM-51-b, saradnja ZPM-50-a;Da;pobožnost ZPM-50-a, ZPM-50-b,  ZPM-50-c, patrijarhat ZPM-48-a, ZPM-50-b, ZPM-50-c;redukcija, imputacija ZPM-50-a, ZPM-50-b, ZPM-50-c, mistifikacija, ignorancija;2;;ZS-48;2;;ZS-51-b, ZPM-50-a ;2;;ZPM-48-a, ZPM-48-b, ZPM-51-a, ZPM-51-b;2;;ZS-50, ZS-51-a, ZPM-48-a, ZPM-50-a, ZPM-50-b, ZPM-50-c, ZPM-51-a
19;ZS/ZMP;Pravoslavna vjeronauka;S;9;V9;Dužnost starješina I potčinjenih;Ne;;Da;sloboda ZS-52-a;Da;pobožnost ZS-52-a;ignorancija ZS-52-b;2;;ZS-52-a, ZS-52-b;2;;ZS-53;2;;ZPM-52-a;2;;ZS-52-a 
20;ZS/ZMP;Pravoslavna vjeronauka;S;9;V9;Dužnost prema otadžbini: Važnost I obaveza državnih zakona;Da;rat ZS-54-d ;Da;odgovornost ZPM-54-a, ZPM-54-b;Da;porijeklo, pobožnost;redukcija, mistifikacija, ignorancija ZPM-54-a, ZPM-54-b, ZPM-54-c, ZPM-54-d, ZPM-54-e;2;;ZS-54-c;2;;ZS-55;2;;;2;;ZS-54-a, ZS-54-b 
21;ZS/ZMP;Pravoslavna vjeronauka;S;9;V9;Dužnosti prema crkvenoj zajednici;Ne;;Ne;;Ne;;;2;;ZS-56-a;2;;ZS-56, ZS-57;2;;;0;;
22;ZS/ZMP;Pravoslavna vjeronauka;S;9;V9;O crkvenim zakonima I zapovijestima;Ne;;Da;odgovoronost ZPM-58-a;Da;pobožnost, patrijarhat;redukcija, imputacija;2;;ZS-58, ZS-59 ;2;;ZS-58, ZS-59 ;2;;;0;;
23;ZS/ZMP;Pravoslavna vjeronauka;S;9;V9;Odnos hrišćana prema sveštenoslužiteljima - Odnos hrišćana prema sektama, inovjernima I nevjernima;Da;neprijateljstvo ZS-61-a, pluralizamkaoproblemZPM-61-a;Da;solidarnost ZS-62-b, ZS-62-c, ZPM-62-a, ZPM-62-b, ZPM-62-c, odgovornost ZPM-60-a, ZPM-62-b, ZPM-62-c;Da;pobožnost ZS-62-d, patrijarhat;redukcija ZS-62-c, ZS-62-d, imputacija, mistifikacija;2;;ZPM-62-a, ZPM-62-b, ZPM-62-c;2;;ZS-62-e;2;;ZS-62-a;2;;ZS-61-b, ZS-61-c, ZS-61-d, ZPM-61-b
1;ZS/ZMP;Vjeronauka;B;8;V12;Uvod;Ne;;Da;solidarnost, mir ZS-5;Ne;;;0;;;0;;;0;;;0;;
2;ZS/ZMP;Vjeronauka;B;8;V12;Izazovi I nade;Ne;;Da;odgovornost ZPM-7-c, ZPM-7-e, sloboda ZPM-7-b;Da;pobožnost;redukcija;2;;ZS-7;1;ZPM-7-a, ZPM-7-b, ZPM-7-c, ZS-8-b;;0;;;2;;ZS-6 
3;ZS/ZMP;Vjeronauka;B;8;V12;Poželjne kompetencije mladih;Ne;;Da;odgovornost ZPM-9-b, ZPM-9-c;Da;pobožnost;redukcija;2;;ZS-10, ZPM-10-b;1;ZS-11-a, ZPM-10-b, ZPM-10-c, ZPM-10-d, ZPM-10-e;;1;;ZS-11-b;2;;ZS-10-a 
4;ZS/ZMP;Vjeronauka;B;8;V12;Čistota duhovnosti;Ne;;Ne;;Ne;;;1;ZS-15;ZPM-13-a;2;ZPM-14-b;ZS-13, ZS-14-b, ZS-16-a ;0;;;1;ZPM-14-a ;
5;ZS/ZMP;Vjeronauka;B;8;V12;Kako da završim dan;Ne;;Ne;;Ne;;;1;ZS-20, ZPM-21-a;;2;;ZS-18, ZS-21;0;;;0;;
6;ZS/ZMP;Vjeronauka;B;8;V12;Namazi u posebnim prilikama;Ne;;Ne; ;Ne;;;0;ZS-25-b;;2;ZPM-24-a, ZPM-24-b;ZS-24 ;0;;;1;ZS-25-a;
7;ZS/ZMP;Vjeronauka;B;8;V12;Upoznajmo zakon Božiji;Da;nejednakost ZPM-26-b;Da;jednakost ZS-26-a, ZPM-26-a, odgovornost ZPM-26-b, ZPM-26-c;Da;pobožnost ZPM-26-a, ZPM-26-b, ZPM-26-c ;redukcija ZS-26-a, mistifikacija;1;ZPM-26-d, ZPM-28-d, ZPM-28-c, ZPM-28-e ;ZS-26-b;2;;ZS-28;0;;;0;;
8;ZS/ZMP;Vjeronauka;B;8;V12;Vrednovanje djela u zakonu Božijem;Ne;;Ne;;Ne;;;2;;ZPM-32-a, ZPM-32-b, ZPM-32-c, ZPM-32-d ;2;;ZS-31-a;1;ZS-31-b;;0;;
9;ZS/ZMP;Vjeronauka;B;8;V12;Prijevod Kur'ana na bosanskom jeziku;Ne;;Ne;;Ne;;;2;;ZS-34, ZS-36, ZS-37, ZPM-36-a;1;ZPM-34-c, ZPM-34-d, ZPM-34-e, ZPM-37-c;;0;;;2;;ZPM-34-a
10;ZS/ZMP;Vjeronauka;B;8;V12;Čuvanje tradicije;Da;nejednakost ZPM-40-a;Ne;;Ne;;;1;ZS-41, ZPM-50-a, ZPM-51-a, ZPM-51-b, ZPM-51-c;;2;;ZS-39 ;2;;ZS-42 ;0;;
11;ZS/ZMP;Vjeronauka;B;8;V12;Božiji poslanici - naši učitelji;Ne;;Da;odgovornost ZPM-44-b, jednakost ZPM-46-a;Da;pobožnost ZPM-44-a, ZPM-44-b;redukcija ZPM-44-a, ZPM-44-b;1;ZS-45-b ;;2;;ZS-45-a;1;ZS-46;;0;;
12;ZS/ZMP;Vjeronauka;B;8;V12;Mudrost u prosuđivanju;Ne;;Da;jednakost ZS-49-b, odgovornost ZPM-48-a, ZPM-48-d,  ZPM-48-e,  ZPM-48-f, mir ZPM-49-c, sloboda ZPM-49-f;Da;pobožnost ZPM-47-a, ZPM-48-b, ZPM-48-d, ZPM-48-e, ZPM-48-f;ignorancija ZS-49-b, redukcija;2;ZS-50-a;ZS-48-a, ZS-49-c ;1;ZS-50-b, ZPM-48-b, ZPM-48-c, ZPM-49-g, ZPM-49-h, ZPM-49-I, ZPM-50-a ;;1;ZS-48-b, ZS-49-a;;0;;
13;ZS/ZMP;Vjeronauka;B;8;V12;Blagodati Božije nas približavaju Bogu;Ne;;Ne;;Ne;;;1;ZS-52-c, ZS-53, ZPM-54-c;ZS-52-a, ZS-52-b ;2;ZPM-52-a, ZPM-52-b;ZS-54-a ;0;;;1;ZPM-54-c ;
14;ZS/ZMP;Vjeronauka;B;8;V12;Greške, grijesi I posljedice;Ne;;Da;odgovornost ZS-56, ZPM-55-a, ZPM-56-a;Da;pobožnost ;redukcija;1;ZS-58, ZPM-57-a, ZPM-57-b, ZPM-58-a, ZPM-59-a, ZPM-59-b, ZPM-59-c, ZPM-59-d, ZPM-59-e, ZPM-59-f ;ZS-59-b;2;;ZS-55, ZS-57-a, ZS-59-a;1;ZS-57-b, ZPM-59-c, ZPM-59-f;;0;;
15;ZS/ZMP;Vjeronauka;B;8;V12;Priznanje I vlastita odgovornost;Ne;;Da;odgovornost ZPM-60-a, ZPM-60-b, ZPM-60-c , ZPM-60-d, ZPM-60-e, saradnja ZPM-61-b;Da;pobožnost ;redukcija;1;ZS-62-a, ZPM-62-c;;2;;ZS-61, ZS-63-a;1;ZS-62-b;;1;ZS-62-c;
16;ZS/ZMP;Vjeronauka;B;8;V12;Savjest kao ogledalo moje duše;Ne;;Da;odgovornost ZPM-66-a;Da;pobožnost ;redukcija;1;ZS-66-b, ZPM-57-a, ZPM-57-b, ZPM-57-c ;ZS-64;1;ZS-65-a, ZPM-64-b, ZPM-65-a, ZPM-65-b, ZPM-66-a;ZS-67;0;;;0;;
17;ZS/ZMP;Vjeronauka;B;8;V12;Život u vjeri, ljubavi I nadi;Ne;;Da;život ZS-69, ZPM-68-a, ZPM-68-c, odgovornost ZPM-68-b, ZPM-69-e;Da;pobožnost;redukcija;0;;ZS-70-a;1;ZS-70-b, ZPM-70-c, ZPM-70-d;ZS-70-c;2;;;2;;ZS-68, ZPM-69-d
18;ZS/ZMP;Vjeronauka;B;8;V12;Prolaznost I vječnost;Ne;;Da;jednakost ZPM-71-a;Da;pobožnost ;mistifikacija ZPM-71-a, redukcija ZPM-72-a, ZPM-72-b, ZPM-72-c ;2;;ZS-72-a, ZS-74 ;1;ZPM-75-b;;0;;;1;ZS-75-a;
19;ZS/ZMP;Vjeronauka;B;8;V12;Radost vječnog života;Ne;;Da;odgovornost, saradnja ZPM-76, ZPM-77, ZPM-78-a;Da;pobožnost;redukcija;2;;ZS-77;2;ZPM-77-b;ZS-79-b ;1;ZS-79-a;;0;;
20;ZS/ZMP;Vjeronauka;B;8;V12;Posljedica griješenja;Ne;;Da;život, solidarnost ZPM-80-a, odgovornost ZPM-80-b, ZPM-82-a, ZPM-82-b, saradnja ZPM-81-a, ZPM-81-b;Da;pobožnost;redukcija;1;ZS-83-a;;2;;ZS-81, ZS-84;1;ZS-83-b ;;0;;
21;ZS/ZMP;Vjeronauka;B;8;V12;Moralnost u životu;Ne;;Da;saradnja ZS-87-a, odgovornost ZPM-85-a;Da;porijeklo ZS-87-a, pobožnost;ignorancija ZS-87-a, redukcija;2;ZPM-87-b, ZPM-87-c;ZS-86-a, ZS-86-b ;1;ZPM-86-a, ZPM-86-b;ZS-87-c, ZS-86-c, ZS-87-b;0;;;0;;
22;ZS/ZMP;Vjeronauka;B;8;V12;Kako biti moralan;Ne;;Ne;;Ne;;;2;ZPM-88-a, ZPM-89-f, ZPM-89-g;ZS-89-b ;2;ZPM-89-c;ZPM-89-a ;1;ZPM-89-d, ZPM-89-g;;0;;
23;ZS/ZMP;Vjeronauka;B;8;V12;Šta čovjeka čini čovjekom;Ne;;Da;pluralizam, jednakost ZPM-90-a, ZPM-90-b, ZPM-90-c;Ne;;;1;ZS-91-b, ZPM-92-a;ZS-91-a, ZS-92-b;1;ZS-92-c, ZPM-92-b;;1;ZPM-92-c;;1;;ZS-91-c, ZS-92-a
24;ZS/ZMP;Vjeronauka;B;8;V12;Razvoj zajednice muslimana;Ne;;Ne;;Ne;;;2;;ZS-98, ZS-93, ZPM-95-a;1;ZS-97, ZPM-96-a, ZPM-97-a;ZS-95;0;;;0;;
25;ZS/ZMP;Vjeronauka;B;8;V12;Oblici muslimanskog zajedništva;Da;nejednakost ZPM-99-d;Da;solidarnost, saradnja ZPM-99-a, ZPM-99-b, jednakost ZPM-100-a, ZPM-100-b;Da;pobožnost;redukcija;2;;ZS-102;2;ZPM-101-b, ZPM-101-c ;ZS-101-a ;0;;;2;;ZS-99-a
26;ZS/ZMP;Vjeronauka;B;8;V12;Nastanak I razvoj Islamske zajednice u Bosni I Hercegovini;Da ;viktimologija ZPM-103-a, neodgovoranpristupprošlosti ZPM-104-a, ZPM-105-a, ZPM-105-b;Ne;;Ne;;;2;ZPM-106-b;ZPM-106-a;2;;ZS-106;0;;;0;;
27;ZS/ZMP;Vjeronauka;B;8;V12;Islamska zajednica danas;Ne;;Ne;;Ne;;;1;ZPM-109-b, ZPM-109-c, ZPM-109-d, ZPM-109-e, ZPM-109-f;;2;;ZS-109-a;0;;;0;;
28;ZS/ZMP;Vjeronauka;B;8;V12;Kako se nekad u Bosni živjelo;Da;nejednakost, religijskiekskluzivizam ZPM-111-d;Ne;;Ne;;;1;ZPM-111-a, ZPM-111-b, ZPM-113-d;;2;;ZS-111-a, ZS-113-a;0;;;2;;ZPM-111-c
29;ZS/ZMP;Vjeronauka;B;8;V12;Šeheri u Bosni I Hercegovini;Ne;;Ne;;Ne;;;1;ZPM-114-a, ZPM-117-a, ZPM-117-b, ZPM-117-c, ZPM-117-d, ZPM-117-e, ZPM-117-f, ZPM-117-g;;2;ZPM-114-b, ZPM-114-c ;ZS-114, ZS-117-a, ZS-117-b;0;;;2;;ZS-116
30;ZS/ZMP;Vjeronauka;B;8;V12;Objekti nastali iz duhovnosti;Da;viktimologija ZPM-120-a;Da;stvaralaštvo, različitost ZPM-119-a, ZPM-119-b;Ne;;;2;ZPM-124-a, ZPM-125-a, ZPM-125-b, ZPM-125-c;ZPM-124-a;2;;ZS-121, ZS-124-a;0;;;0;;
31;ZS/ZMP;Vjeronauka;B;8;V12;Mubarek dani I noći;Ne;;Ne;;Ne;;;2;;ZS-130-b, ZPM-133-a;2;;ZS-130-a, ZS-133-a ;1;ZS-133-b;;0;;
32;ZS/ZMP;Vjeronauka;B;8;V12;Ibadet u odabranim danima I noćima;Ne;;Da ;solidarnost ZS-135;Da;pobožnost ;redukcija;2;;ZPM-137-a;2;;ZS-136, ZS-137;0;;;0;;
1;ZPM/NI;Vjeronauka;S;8;V8;O crkvi uopšte;Ne;;Ne;;Ne;;;2;;NI-5, NI-6;2;;NI-7;2;;;0;;
2;ZPM/NI;Vjeronauka;S;8;V8;Istovjetnost crkve I hrama Bogoslužnog mjesta;Ne;;Ne;;Ne;;;2;;NI-8-2;2;;NI-8-4, NI-9;2;;NI-8-3;0;;
3;ZPM/NI;Vjeronauka;S;8;V8;O Bogu;Da;neravnopravnost ZPM-11-a;Ne;;Ne;;;2;;NI-10-1, NI-10-2, NI-10-3, NI-10-4, NI-11-1, NI-11-3, NI-12-1, NI-12-2, NI-12-3, NI-12-4;2;;NI-11-2, NI-12-5;2;;NI-10-1;0;;
4;ZPM/NI;Vjeronauka;S;8;V8;O svijetu I čovjeku - postanak svijeta, materijalni I duhovni svijet;Ne;;Ne;;Ne;;;2;;;2;;NI-14-3;2;;NI-13, NI-14-1, NI-14-2;0;;
5;ZPM/NI;Vjeronauka;S;8;V8;O čovjeku ;Da;neravnopravnost NI-15-1 ;Ne;;Ne;;;2;;;2;;NI-16, NI-15-2, NI-15-3, NI-15-4;2;;;0;;
6;ZPM/NI;Vjeronauka;S;8;V8;Besmrtnost duše;Ne;;Da;jednakost ZPM-18-c;Da;pobožnost, patrijarhat;redukcija, mistifikacija;2;;NI-18-1, NI-18-2;2;;NI-18-5, NI-18-3;2;;NI-18-4;0;;
7;ZPM/NI;Vjeronauka;S;8;V8;Pogrešne teorije o postanku svijeta I života;Da;pluralizamkaoproblem, neravnopravnost NI-19-1;Ne;;Ne;;;2;;NI-19-2;2;;NI-20-1, NI-20-2;2;;;0;;
8;ZPM/NI;Vjeronauka;S;8;V8;Hrišćansko učenje o prvobitnom stanju čovjeka;Da;neravnopravnost NI-21-2;Ne;;Ne;;;2;;NI-22-1, NI-22-2;2;;NI-22-3;2;;NI-21-1;0;;
9;ZPM/NI;Vjeronauka;S;8;V8;O božijem promislu;Ne;;Ne;;Ne;;;2;;;2;;NI-23-3, NI-23-4;2;;NI-23-1, NI-23-2;0;;
10;ZPM/NI;Vjeronauka;S;8;V8;O fatalizmu;Ne;;Ne;;Ne;;;2;;NI-25-1, NI-25-2;2;;NI-26-2;2;;NI-26-1;0;;
11;ZPM/NI;Vjeronauka;S;8;V8;Neosnovanost prigovora da Hristos nije historijska ličnost;Ne;;Ne;;Ne;;;2;;NI-27-2;2;;NI-28-3;2;NI-27-3, NI-28-1, NI-28-2;NI-27-1 ;0;;
12;ZPM/NI;Vjeronauka;S;8;V8;Vaskrsenje Hristovo kao temelj hrišćanske istine;Ne;;Ne;;Ne;;;2;;NI-29-1;2;;NI-29-3;2;;NI-29-2;0;;
13;ZPM/NI;Vjeronauka;S;8;V8;O Bogu - Duhu Svetom;Ne;;Ne;;Ne;;;2;;;2;;NI-30-4, NI-30-1;2;;NI-30-2, NI-30-3;0;;
14;ZPM/NI;Vjeronauka;S;8;V8;Cilj I svojstvo Crkve;Ne;;Ne;;Ne;;;2;;;2;;NI-31-1, NI-31-2, NI-31-3, NI-32-1, NI-32-2;2;;;0;;
15;ZPM/NI;Vjeronauka;S;8;V8;Zagrobni život;Ne;;Ne;;Ne;;;2;;NI-33-1;2;;NI-34-2;1;NI-33-2;;0;;
16;ZPM/NI;Vjeronauka;S;8;V8;Poseban sud poslije smrti;Ne;;Ne;;Ne;;;2;;;2;;NI-35, NI-36;2;;;0;;
17;ZPM/NI;Vjeronauka;S;8;V8;Vaskrsenje mrtvih;Ne;;Ne;;Ne;;;2;;NI-38-1, NI-38-2;2;;NI-38-3;2;;;0;;
18;ZPM/NI;Vjeronauka;S;8;V8;O sektama;Da;pluralizamkaoproblem ZPM-39-a, ZPM-39-b, ZPM-39-c, ZPM-39-d, neprijateljstvo ZPM-40-a, ZPM-40-b;Ne;;Ne;;;2;;NI-40-1, NI-40-3;2;;NI-41;2;;NI-40-2, NI-40-4;2;;ZPM-39-c, ZPM-39-d 
19;ZPM/NI;Vjeronauka;S;8;V8;Jehovini svjedoci;Ne;;Ne;;Ne;;;2;;;2;;NI-42-4;2;;NI-42-3;0;;
20;ZPM/NI;Vjeronauka;S;8;V8;Satanisti;Ne;;Ne;;Ne;;;2;;;2;;NI-43-2;2;;NI-43-1;0;;
21;ZPM/NI;Vjeronauka;S;8;V8;Adventisti;Ne;;Ne;;Ne;;;2;;NI-44-1, NI-44-2;2;;NI-44-4;2;;NI-44-3;0;;
22;ZPM/NI;Vjeronauka;S;8;V8;Pentakostalci - postanak;Ne;;Ne;;Ne;;;2;;NI-45-3;2;;NI-45-1, NI-45-4, NI-45-3;2;;;0;;
23;ZPM/NI;Vjeronauka;S;8;V8;Vječni život;Da;pluralizamkaoproblem, nejednakost ZPM-46-b, neravnopravnost, isključivost NI-46-4;Ne;;Ne;;;2;;NI-46-2, NI-46-3;2;;NI-46-1, NI-46-5;2;;;0;;
1;ZS/ZPM;Vjeronauka;S;6;V6;Istorija hrišćanske crkve;Ne;;Ne;;Ne;;;2;;;2;;ZS-6-b;2;;;0;;
2;ZS/ZPM;Vjeronauka;S;6;V6;Prvi period;Da;pluralizamkaoproblem ZS-7-c, neprijateljstvo ZPM-7-a, ZPM-8-b, ZPM-8-c;Ne;;Ne;;;0;;;2;;ZS-9-a;2;;ZS-7-d;2;;ZS-7-b
3;ZS/ZPM;Vjeronauka;S;6;V6;Jevreji gone hrišćane;Da;neprijateljstvo ZS-9-c, ZPM-10-a;Ne;;Ne;;;0;;;2;;ZS-10-c;2;;;2;;ZS-9-c 
4;ZS/ZPM;Vjeronauka;S;6;V6;Obraćanje Salva u hrišćanstvo;Da;neprijateljstvo ZPM-11-a, ZPM-11-b, ZPM-11-c, pluralizamkaoproblem ZPM-11-d;Ne;;Ne;;;0;;;2;;ZS-11-d;2;;;2;;ZS-11-c
5;ZS/ZPM;Vjeronauka;S;6;V6;Propast Jerusalima;Da;neprijateljstvo ZPM-12-a, viktimologija ZPM-12-d;Ne;;Ne;;;2;;ZS-12-c ;2;;ZS-12-e;2;;;2;;
6;ZS/ZPM;Vjeronauka;S;6;V6;Apostolski sabor u Jerusalimu;Da;neravnopravnost ZS-13-a, pluralizamkaoproblem ZPM-13-a, netolerancija ZPM-13-c;Ne;;Ne;;;2;;;2;;ZS-13-b;2;;;0;;
7;ZS/ZPM;Vjeronauka;S;6;V6;Prvo misionarsko putovanje svetog apostola Pavla;Da;netolerancija ZPM-15-a, ZPM-15-b, pluralizamkaoproblem ZPM-15-c;Ne;;Ne;;;2;;;2;;;2;; ZS-15-a;0;;
8;ZS/ZPM;Vjeronauka;S;6;V6;Drugo misionarsko putovanje svetog apostola Pavla;Ne;;Ne;;Ne;;;2;;;2;;ZS-16;2;;;0;;
9;ZS/ZPM;Vjeronauka;S;6;V6;Treće misionarsko putovanje svetog apostola Pavla;Da;neprijateljstvo ZPM-18-b;Ne;;Ne;;;2;;;2;;;2;;;0;;
10;ZS/ZPM;Vjeronauka;S;6;V6;Gonjenje hrišćana od strane rimskih careva;Da;neravnopravnost ZS-19-f, viktimologija, nasilje ZPM-18-c, ZPM-19-b, ZPM-19-c;Da;sloboda ZS-19-e;Da;pobožnost;;2;;;2;;ZS-19-g;2;;;0;;
11;ZS/ZPM;Vjeronauka;S;6;V6;Car Konstantin I carica Jelena;Da;neravnopravnost ZS-20-c;Da;sloboda ZS-20-b;Da;pobožnost, prošlost;redukcija;2;;;2;;ZS-21;2;;;0;;
12;ZS/ZPM;Vjeronauka;S;6;V6;Drugi period (Prvi Vaseljenski sabor);Da;pluralizamkaoproblem ZPM-23-c;Ne;;Ne;;;2;;;2;;ZS-24-b;2;;ZS-24-a;2;;ZS-23
13;ZS/ZPM;Vjeronauka;S;6;V6;Drugi Valjesenski sabor;Ne;;Ne;;Ne;;;2;;ZS-25-a;2;;ZS-25-b;2;;;0;;
14;ZS/ZPM;Vjeronauka;S;6;V6;Treći I četvrti Vaseljenski sabor;Da;pluralizamkaoproblem ZPM-27-a;Ne;;Ne;;;2;;;2;;ZS-27-b;2;;ZS-27-a;0;;
15;ZS/ZPM;Vjeronauka;S;6;V6;Peti I šesti Vaseljevski sabor;Da;pluralizamkaoproblem ZPM-28-a;Ne;;Ne;;;2;;ZS-28-a;2;;ZS-28-b;2;;ZS-28-c;0;;
